"No.","Time","Source","Destination","Protocol","Length","Info"
"4","0.090674","13.107.6.171","192.168.1.14","TCP","60","443  >  59734 [ACK] Seq=1 Ack=1441 Win=2053 Len=0"
"5","0.092081","13.107.6.171","192.168.1.14","TCP","60","443  >  59734 [ACK] Seq=1 Ack=2706 Win=2048 Len=0"
"6","0.094030","13.107.6.171","192.168.1.14","TCP","60","443  >  59734 [ACK] Seq=1 Ack=4146 Win=2053 Len=0"
"7","0.094861","13.107.6.171","192.168.1.14","TCP","60","443  >  59734 [ACK] Seq=1 Ack=4461 Win=2051 Len=0"
"8","0.129142","18.214.185.18","192.168.1.14","TLSv1.2","85","Application Data"
"9","0.135394","13.107.6.171","192.168.1.14","TLSv1.2","419","Application Data"
"10","0.136171","13.107.6.171","192.168.1.14","TLSv1.2","92","Application Data"
"15","1.184403","13.107.6.171","192.168.1.14","TCP","60","443  >  59734 [ACK] Seq=404 Ack=5901 Win=2053 Len=0"
"16","1.186316","13.107.6.171","192.168.1.14","TCP","60","443  >  59734 [ACK] Seq=404 Ack=7166 Win=2048 Len=0"
"17","1.187772","13.107.6.171","192.168.1.14","TCP","60","443  >  59734 [ACK] Seq=404 Ack=8606 Win=2053 Len=0"
"18","1.188578","13.107.6.171","192.168.1.14","TCP","60","443  >  59734 [ACK] Seq=404 Ack=8921 Win=2051 Len=0"
"20","1.229577","13.107.6.171","192.168.1.14","TLSv1.2","397","Application Data"
"21","1.229578","13.107.6.171","192.168.1.14","TLSv1.2","92","Application Data"
"23","1.391917","52.114.77.34","192.168.1.14","TCP","60","443  >  49990 [RST, ACK] Seq=1 Ack=1 Win=0 Len=0"
"28","1.704693","13.107.6.171","192.168.1.14","TCP","60","443  >  59733 [ACK] Seq=1 Ack=114 Win=2047 Len=0"
"29","1.707784","13.107.6.171","192.168.1.14","TCP","60","443  >  59733 [ACK] Seq=1 Ack=1554 Win=2053 Len=0"
"30","1.708637","13.107.6.171","192.168.1.14","TCP","60","443  >  59733 [ACK] Seq=1 Ack=2312 Win=2050 Len=0"
"31","1.744330","13.107.6.171","192.168.1.14","TLSv1.2","281","Application Data"
"33","1.834003","52.114.159.22","192.168.1.14","TCP","60","443  >  63756 [ACK] Seq=1 Ack=1636 Win=1026 Len=0"
"34","1.835023","52.114.159.22","192.168.1.14","TLSv1.2","482","Application Data"
"38","1.888342","13.107.6.171","192.168.1.14","TCP","60","443  >  59734 [ACK] Seq=785 Ack=10361 Win=2053 Len=0"
"39","1.890039","13.107.6.171","192.168.1.14","TCP","60","443  >  59734 [ACK] Seq=785 Ack=11626 Win=2048 Len=0"
"40","1.891731","13.107.6.171","192.168.1.14","TCP","60","443  >  59734 [ACK] Seq=785 Ack=13066 Win=2053 Len=0"
"41","1.892507","13.107.6.171","192.168.1.14","TCP","60","443  >  59734 [ACK] Seq=785 Ack=13442 Win=2051 Len=0"
"45","2.003712","13.107.6.171","192.168.1.14","TCP","60","443  >  59734 [ACK] Seq=785 Ack=14882 Win=2053 Len=0"
"46","2.004973","13.107.6.171","192.168.1.14","TCP","60","443  >  59734 [ACK] Seq=785 Ack=16147 Win=2048 Len=0"
"47","2.006767","13.107.6.171","192.168.1.14","TCP","60","443  >  59734 [ACK] Seq=785 Ack=17587 Win=2053 Len=0"
"48","2.008346","13.107.6.171","192.168.1.14","TCP","60","443  >  59734 [ACK] Seq=785 Ack=19027 Win=2047 Len=0"
"49","2.009142","13.107.6.171","192.168.1.14","TCP","60","443  >  59734 [ACK] Seq=785 Ack=19037 Win=2047 Len=0"
"50","2.009908","13.107.6.171","192.168.1.14","TCP","60","443  >  59734 [ACK] Seq=785 Ack=20299 Win=2053 Len=0"
"51","2.039376","13.107.6.171","192.168.1.14","TLSv1.2","411","Application Data"
"52","2.040155","13.107.6.171","192.168.1.14","TLSv1.2","92","Application Data"
"54","2.078832","13.107.6.171","192.168.1.14","TLSv1.2","483","Application Data"
"55","2.079613","13.107.6.171","192.168.1.14","TLSv1.2","92","Application Data"
"59","2.134180","13.107.6.171","192.168.1.14","TCP","60","443  >  59734 [ACK] Seq=1647 Ack=21739 Win=2047 Len=0"
"60","2.136407","13.107.6.171","192.168.1.14","TCP","60","443  >  59734 [ACK] Seq=1647 Ack=23004 Win=2053 Len=0"
"61","2.137562","13.107.6.171","192.168.1.14","TCP","60","443  >  59734 [ACK] Seq=1647 Ack=24444 Win=2047 Len=0"
"62","2.138381","13.107.6.171","192.168.1.14","TCP","60","443  >  59734 [ACK] Seq=1647 Ack=24759 Win=2053 Len=0"
"63","2.180753","13.107.6.171","192.168.1.14","TLSv1.2","393","Application Data"
"64","2.181533","13.107.6.171","192.168.1.14","TLSv1.2","92","Application Data"
"67","2.448462","52.109.76.69","192.168.1.14","TLSv1.2","192","Application Data"
"70","2.998647","52.109.76.69","192.168.1.14","TLSv1.2","192","Application Data"
"74","3.233902","13.107.6.171","192.168.1.14","TCP","60","443  >  59734 [ACK] Seq=2024 Ack=26199 Win=2047 Len=0"
"75","3.235303","13.107.6.171","192.168.1.14","TCP","60","443  >  59734 [ACK] Seq=2024 Ack=27464 Win=2053 Len=0"
"76","3.237293","13.107.6.171","192.168.1.14","TCP","60","443  >  59734 [ACK] Seq=2024 Ack=28904 Win=2047 Len=0"
"77","3.238124","13.107.6.171","192.168.1.14","TCP","60","443  >  59734 [ACK] Seq=2024 Ack=29219 Win=2053 Len=0"
"79","3.281459","13.107.6.171","192.168.1.14","TLSv1.2","450","Application Data"
"80","3.282230","13.107.6.171","192.168.1.14","TLSv1.2","92","Application Data"
"109","3.527518","13.107.6.171","192.168.1.14","TCP","60","443  >  59734 [ACK] Seq=2458 Ack=30659 Win=2047 Len=0"
"110","3.528786","13.107.6.171","192.168.1.14","TCP","60","443  >  59734 [ACK] Seq=2458 Ack=32016 Win=2053 Len=0"
"126","3.531221","13.107.6.171","192.168.1.14","TCP","60","443  >  59734 [ACK] Seq=2458 Ack=33456 Win=2047 Len=0"
"127","3.532882","13.107.6.171","192.168.1.14","TCP","60","443  >  59734 [ACK] Seq=2458 Ack=34896 Win=2053 Len=0"
"128","3.534804","13.107.6.171","192.168.1.14","TCP","60","443  >  59734 [ACK] Seq=2458 Ack=34906 Win=2053 Len=0"
"129","3.541214","13.107.6.171","192.168.1.14","TCP","60","443  >  59734 [ACK] Seq=2458 Ack=36346 Win=2047 Len=0"
"130","3.542051","13.107.6.171","192.168.1.14","TCP","60","443  >  59734 [ACK] Seq=2458 Ack=37786 Win=2053 Len=0"
"131","3.542052","13.107.6.171","192.168.1.14","TCP","60","443  >  59734 [ACK] Seq=2458 Ack=37796 Win=2053 Len=0"
"132","3.542052","13.107.6.171","192.168.1.14","TCP","60","443  >  59734 [ACK] Seq=2458 Ack=39236 Win=2047 Len=0"
"133","3.542052","13.107.6.171","192.168.1.14","TCP","60","443  >  59734 [ACK] Seq=2458 Ack=40676 Win=2053 Len=0"
"134","3.542052","13.107.6.171","192.168.1.14","TCP","60","443  >  59734 [ACK] Seq=2458 Ack=40686 Win=2053 Len=0"
"135","3.544343","13.107.6.171","192.168.1.14","TCP","60","443  >  59734 [ACK] Seq=2458 Ack=42126 Win=2047 Len=0"
"136","3.545126","13.107.6.171","192.168.1.14","TCP","60","443  >  59734 [ACK] Seq=2458 Ack=43566 Win=2053 Len=0"
"137","3.545126","13.107.6.171","192.168.1.14","TCP","60","443  >  59734 [ACK] Seq=2458 Ack=43576 Win=2053 Len=0"
"138","3.545924","13.107.6.171","192.168.1.14","TCP","60","443  >  59734 [ACK] Seq=2458 Ack=45016 Win=2047 Len=0"
"139","3.546752","13.107.6.171","192.168.1.14","TCP","60","443  >  59734 [ACK] Seq=2458 Ack=46456 Win=2053 Len=0"
"140","3.547585","13.107.6.171","192.168.1.14","TCP","60","443  >  59734 [ACK] Seq=2458 Ack=46466 Win=2053 Len=0"
"141","3.548868","13.107.6.171","192.168.1.14","TCP","60","443  >  59734 [ACK] Seq=2458 Ack=47906 Win=2047 Len=0"
"142","3.549702","13.107.6.171","192.168.1.14","TCP","60","443  >  59734 [ACK] Seq=2458 Ack=48628 Win=2053 Len=0"
"143","3.551291","13.107.6.171","192.168.1.14","TCP","60","443  >  59734 [ACK] Seq=2458 Ack=50068 Win=2047 Len=0"
"144","3.553581","13.107.6.171","192.168.1.14","TCP","60","443  >  59734 [ACK] Seq=2458 Ack=51508 Win=2053 Len=0"
"145","3.554414","13.107.6.171","192.168.1.14","TCP","60","443  >  59734 [ACK] Seq=2458 Ack=51518 Win=2053 Len=0"
"146","3.555246","13.107.6.171","192.168.1.14","TCP","60","443  >  59734 [ACK] Seq=2458 Ack=52958 Win=2047 Len=0"
"147","3.556529","13.107.6.171","192.168.1.14","TCP","60","443  >  59734 [ACK] Seq=2458 Ack=54398 Win=2053 Len=0"
"148","3.557360","13.107.6.171","192.168.1.14","TCP","60","443  >  59734 [ACK] Seq=2458 Ack=54408 Win=2053 Len=0"
"149","3.558194","13.107.6.171","192.168.1.14","TLSv1.2","96","Application Data"
"150","3.559043","13.107.6.171","192.168.1.14","TCP","60","443  >  59734 [ACK] Seq=2500 Ack=55848 Win=2047 Len=0"
"151","3.560181","13.107.6.171","192.168.1.14","TCP","60","443  >  59734 [ACK] Seq=2500 Ack=57288 Win=2053 Len=0"
"152","3.561015","13.107.6.171","192.168.1.14","TCP","60","443  >  59734 [ACK] Seq=2500 Ack=57298 Win=2053 Len=0"
"153","3.562182","13.107.6.171","192.168.1.14","TCP","60","443  >  59734 [ACK] Seq=2500 Ack=58738 Win=2047 Len=0"
"154","3.563539","13.107.6.171","192.168.1.14","TCP","60","443  >  59734 [ACK] Seq=2500 Ack=60188 Win=2053 Len=0"
"155","3.565564","13.107.6.171","192.168.1.14","TCP","60","443  >  59734 [ACK] Seq=2500 Ack=61628 Win=2047 Len=0"
"156","3.567125","13.107.6.171","192.168.1.14","TCP","60","443  >  59734 [ACK] Seq=2500 Ack=63068 Win=2053 Len=0"
"157","3.567957","13.107.6.171","192.168.1.14","TCP","60","443  >  59734 [ACK] Seq=2500 Ack=63078 Win=2053 Len=0"
"158","3.569555","13.107.6.171","192.168.1.14","TCP","60","443  >  59734 [ACK] Seq=2500 Ack=64518 Win=2047 Len=0"
"159","3.570389","13.107.6.171","192.168.1.14","TCP","60","443  >  59734 [ACK] Seq=2500 Ack=65240 Win=2053 Len=0"
"160","3.571821","13.107.6.171","192.168.1.14","TCP","60","443  >  59734 [ACK] Seq=2500 Ack=66680 Win=2047 Len=0"
"161","3.573343","13.107.6.171","192.168.1.14","TCP","60","443  >  59734 [ACK] Seq=2500 Ack=68120 Win=2053 Len=0"
"162","3.574175","13.107.6.171","192.168.1.14","TCP","60","443  >  59734 [ACK] Seq=2500 Ack=68130 Win=2053 Len=0"
"163","3.575573","13.107.6.171","192.168.1.14","TCP","60","443  >  59734 [ACK] Seq=2500 Ack=69570 Win=2047 Len=0"
"164","3.576860","13.107.6.171","192.168.1.14","TCP","60","443  >  59734 [ACK] Seq=2500 Ack=71010 Win=2053 Len=0"
"165","3.577694","13.107.6.171","192.168.1.14","TCP","60","443  >  59734 [ACK] Seq=2500 Ack=71020 Win=2053 Len=0"
"166","3.578844","13.107.6.171","192.168.1.14","TCP","60","443  >  59734 [ACK] Seq=2500 Ack=72460 Win=2047 Len=0"
"167","3.580339","13.107.6.171","192.168.1.14","TCP","60","443  >  59734 [ACK] Seq=2500 Ack=73900 Win=2053 Len=0"
"168","3.583196","13.107.6.171","192.168.1.14","TCP","60","443  >  59734 [ACK] Seq=2500 Ack=73910 Win=2053 Len=0"
"169","3.584035","13.107.6.171","192.168.1.14","TCP","60","443  >  59734 [ACK] Seq=2500 Ack=75350 Win=2047 Len=0"
"170","3.584868","13.107.6.171","192.168.1.14","TCP","60","443  >  59734 [ACK] Seq=2500 Ack=76790 Win=2053 Len=0"
"171","3.584868","13.107.6.171","192.168.1.14","TCP","60","443  >  59734 [ACK] Seq=2500 Ack=76800 Win=2053 Len=0"
"172","3.586509","13.107.6.171","192.168.1.14","TCP","60","443  >  59734 [ACK] Seq=2500 Ack=78240 Win=2047 Len=0"
"173","3.588143","13.107.6.171","192.168.1.14","TCP","60","443  >  59734 [ACK] Seq=2500 Ack=79690 Win=2053 Len=0"
"174","3.589497","13.107.6.171","192.168.1.14","TCP","60","443  >  59734 [ACK] Seq=2500 Ack=81130 Win=2047 Len=0"
"175","3.590305","13.107.6.171","192.168.1.14","TCP","60","443  >  59734 [ACK] Seq=2500 Ack=81852 Win=2053 Len=0"
"176","3.592138","13.107.6.171","192.168.1.14","TCP","60","443  >  59734 [ACK] Seq=2500 Ack=83292 Win=2047 Len=0"
"177","3.593779","13.107.6.171","192.168.1.14","TCP","60","443  >  59734 [ACK] Seq=2500 Ack=84732 Win=2053 Len=0"
"178","3.594549","13.107.6.171","192.168.1.14","TCP","60","443  >  59734 [ACK] Seq=2500 Ack=84742 Win=2053 Len=0"
"179","3.595879","13.107.6.171","192.168.1.14","TCP","60","443  >  59734 [ACK] Seq=2500 Ack=86182 Win=2047 Len=0"
"180","3.597280","13.107.6.171","192.168.1.14","TCP","60","443  >  59734 [ACK] Seq=2500 Ack=87686 Win=2053 Len=0"
"182","3.599394","13.107.6.171","192.168.1.14","TCP","60","443  >  59734 [ACK] Seq=2500 Ack=89126 Win=2047 Len=0"
"183","3.601980","13.107.6.171","192.168.1.14","TCP","60","443  >  59734 [ACK] Seq=2500 Ack=90483 Win=2053 Len=0"
"184","3.603252","13.107.6.171","192.168.1.14","TCP","60","443  >  59734 [ACK] Seq=2500 Ack=91923 Win=2047 Len=0"
"185","3.604540","13.107.6.171","192.168.1.14","TCP","60","443  >  59734 [ACK] Seq=2500 Ack=93373 Win=2053 Len=0"
"186","3.606284","13.107.6.171","192.168.1.14","TCP","60","443  >  59734 [ACK] Seq=2500 Ack=94813 Win=2047 Len=0"
"187","3.608356","13.107.6.171","192.168.1.14","TCP","60","443  >  59734 [ACK] Seq=2500 Ack=96253 Win=2053 Len=0"
"188","3.609189","13.107.6.171","192.168.1.14","TCP","60","443  >  59734 [ACK] Seq=2500 Ack=96263 Win=2053 Len=0"
"189","3.610356","13.107.6.171","192.168.1.14","TCP","60","443  >  59734 [ACK] Seq=2500 Ack=97703 Win=2047 Len=0"
"190","3.612005","13.107.6.171","192.168.1.14","TCP","60","443  >  59734 [ACK] Seq=2500 Ack=99143 Win=2053 Len=0"
"191","3.612838","13.107.6.171","192.168.1.14","TCP","60","443  >  59734 [ACK] Seq=2500 Ack=99153 Win=2053 Len=0"
"192","3.615421","13.107.6.171","192.168.1.14","TCP","60","443  >  59734 [ACK] Seq=2500 Ack=100593 Win=2047 Len=0"
"193","3.616853","13.107.6.171","192.168.1.14","TCP","60","443  >  59734 [ACK] Seq=2500 Ack=102033 Win=2053 Len=0"
"194","3.618439","13.107.6.171","192.168.1.14","TCP","60","443  >  59734 [ACK] Seq=2500 Ack=103473 Win=2047 Len=0"
"195","3.620535","13.107.6.171","192.168.1.14","TCP","60","443  >  59734 [ACK] Seq=2500 Ack=104913 Win=2053 Len=0"
"196","3.622231","13.107.6.171","192.168.1.14","TCP","60","443  >  59734 [ACK] Seq=2500 Ack=106353 Win=2047 Len=0"
"197","3.624019","13.107.6.171","192.168.1.14","TCP","60","443  >  59734 [ACK] Seq=2500 Ack=107793 Win=2053 Len=0"
"198","3.625708","13.107.6.171","192.168.1.14","TCP","60","443  >  59734 [ACK] Seq=2500 Ack=109233 Win=2047 Len=0"
"199","3.627467","13.107.6.171","192.168.1.14","TCP","60","443  >  59734 [ACK] Seq=2500 Ack=110673 Win=2053 Len=0"
"200","3.628978","13.107.6.171","192.168.1.14","TCP","60","443  >  59734 [ACK] Seq=2500 Ack=112113 Win=2047 Len=0"
"201","3.630466","13.107.6.171","192.168.1.14","TCP","60","443  >  59734 [ACK] Seq=2500 Ack=113671 Win=2053 Len=0"
"202","3.632587","13.107.6.171","192.168.1.14","TCP","60","443  >  59734 [ACK] Seq=2500 Ack=115111 Win=2047 Len=0"
"203","3.633518","13.107.6.171","192.168.1.14","TCP","60","443  >  59734 [ACK] Seq=2500 Ack=115765 Win=2053 Len=0"
"204","3.635560","13.107.6.171","192.168.1.14","TCP","60","443  >  59734 [ACK] Seq=2500 Ack=117205 Win=2047 Len=0"
"205","3.636699","13.107.6.171","192.168.1.14","TLSv1.2","590","Application Data"
"206","3.637479","13.107.6.171","192.168.1.14","TCP","60","443  >  59734 [ACK] Seq=3036 Ack=118645 Win=2053 Len=0"
"207","3.638238","13.107.6.171","192.168.1.14","TCP","60","443  >  59734 [ACK] Seq=3036 Ack=118655 Win=2053 Len=0"
"208","3.640222","13.107.6.171","192.168.1.14","TCP","60","443  >  59734 [ACK] Seq=3036 Ack=120095 Win=2047 Len=0"
"209","3.641356","13.107.6.171","192.168.1.14","TCP","60","443  >  59734 [ACK] Seq=3036 Ack=121545 Win=2053 Len=0"
"210","3.642794","13.107.6.171","192.168.1.14","TCP","60","443  >  59734 [ACK] Seq=3036 Ack=122985 Win=2047 Len=0"
"211","3.643882","13.107.6.171","192.168.1.14","TCP","60","443  >  59734 [ACK] Seq=3036 Ack=123707 Win=2053 Len=0"
"212","3.644722","13.107.6.171","192.168.1.14","TLSv1.2","96","Application Data"
"214","3.645601","52.109.76.69","192.168.1.14","TLSv1.2","192","Application Data"
"215","3.645605","13.107.6.171","192.168.1.14","TCP","60","443  >  59734 [ACK] Seq=3078 Ack=125147 Win=2047 Len=0"
"216","3.647282","13.107.6.171","192.168.1.14","TCP","60","443  >  59734 [ACK] Seq=3078 Ack=126587 Win=2053 Len=0"
"217","3.648115","13.107.6.171","192.168.1.14","TCP","60","443  >  59734 [ACK] Seq=3078 Ack=126597 Win=2053 Len=0"
"218","3.649191","13.107.6.171","192.168.1.14","TCP","60","443  >  59734 [ACK] Seq=3078 Ack=128037 Win=2047 Len=0"
"219","3.651296","13.107.6.171","192.168.1.14","TCP","60","443  >  59734 [ACK] Seq=3078 Ack=129477 Win=2053 Len=0"
"220","3.652159","13.107.6.171","192.168.1.14","TCP","60","443  >  59734 [ACK] Seq=3078 Ack=129487 Win=2053 Len=0"
"221","3.653881","13.107.6.171","192.168.1.14","TCP","60","443  >  59734 [ACK] Seq=3078 Ack=130927 Win=2047 Len=0"
"222","3.654716","13.107.6.171","192.168.1.14","TCP","60","443  >  59734 [ACK] Seq=3078 Ack=132367 Win=2053 Len=0"
"223","3.655629","13.107.6.171","192.168.1.14","TCP","60","443  >  59734 [ACK] Seq=3078 Ack=132377 Win=2053 Len=0"
"224","3.656593","13.107.6.171","192.168.1.14","TCP","60","443  >  59734 [ACK] Seq=3078 Ack=133817 Win=2047 Len=0"
"225","3.658112","13.107.6.171","192.168.1.14","TCP","60","443  >  59734 [ACK] Seq=3078 Ack=135257 Win=2053 Len=0"
"226","3.658942","13.107.6.171","192.168.1.14","TCP","60","443  >  59734 [ACK] Seq=3078 Ack=135267 Win=2053 Len=0"
"227","3.660095","13.107.6.171","192.168.1.14","TCP","60","443  >  59734 [ACK] Seq=3078 Ack=136707 Win=2047 Len=0"
"228","3.662164","13.107.6.171","192.168.1.14","TCP","60","443  >  59734 [ACK] Seq=3078 Ack=138147 Win=2053 Len=0"
"229","3.662997","13.107.6.171","192.168.1.14","TCP","60","443  >  59734 [ACK] Seq=3078 Ack=138157 Win=2053 Len=0"
"230","3.663836","13.107.6.171","192.168.1.14","TCP","60","443  >  59734 [ACK] Seq=3078 Ack=139597 Win=2047 Len=0"
"231","3.665156","13.107.6.171","192.168.1.14","TCP","60","443  >  59734 [ACK] Seq=3078 Ack=140319 Win=2053 Len=0"
"232","3.666312","13.107.6.171","192.168.1.14","TCP","60","443  >  59734 [ACK] Seq=3078 Ack=141759 Win=2047 Len=0"
"233","3.667826","13.107.6.171","192.168.1.14","TCP","60","443  >  59734 [ACK] Seq=3078 Ack=143199 Win=2053 Len=0"
"234","3.668659","13.107.6.171","192.168.1.14","TCP","60","443  >  59734 [ACK] Seq=3078 Ack=143209 Win=2053 Len=0"
"235","3.670640","13.107.6.171","192.168.1.14","TCP","60","443  >  59734 [ACK] Seq=3078 Ack=144649 Win=2047 Len=0"
"236","3.672375","13.107.6.171","192.168.1.14","TCP","60","443  >  59734 [ACK] Seq=3078 Ack=146089 Win=2053 Len=0"
"237","3.673154","13.107.6.171","192.168.1.14","TCP","60","443  >  59734 [ACK] Seq=3078 Ack=146099 Win=2053 Len=0"
"238","3.674284","13.107.6.171","192.168.1.14","TCP","60","443  >  59734 [ACK] Seq=3078 Ack=147539 Win=2047 Len=0"
"239","3.675475","13.107.6.171","192.168.1.14","TCP","60","443  >  59734 [ACK] Seq=3078 Ack=148979 Win=2053 Len=0"
"240","3.676242","13.107.6.171","192.168.1.14","TCP","60","443  >  59734 [ACK] Seq=3078 Ack=148989 Win=2053 Len=0"
"241","3.677361","13.107.6.171","192.168.1.14","TCP","60","443  >  59734 [ACK] Seq=3078 Ack=150429 Win=2047 Len=0"
"242","3.678618","13.107.6.171","192.168.1.14","TCP","60","443  >  59734 [ACK] Seq=3078 Ack=151468 Win=2053 Len=0"
"246","3.714713","13.107.6.171","192.168.1.14","TLSv1.2","237","Application Data"
"247","3.742606","13.107.6.171","192.168.1.14","TCP","60","443  >  59734 [ACK] Seq=3261 Ack=152718 Win=2048 Len=0"
"248","3.743442","13.107.6.171","192.168.1.14","TCP","60","443  >  59734 [ACK] Seq=3261 Ack=153297 Win=2053 Len=0"
"250","3.798225","13.107.6.171","192.168.1.14","TLSv1.2","526","Application Data"
"251","3.799010","13.107.6.171","192.168.1.14","TLSv1.2","92","Application Data"
"257","4.119398","52.114.159.22","192.168.1.14","TCP","60","443  >  63756 [ACK] Seq=429 Ack=3905 Win=1026 Len=0"
"258","4.120943","52.114.159.22","192.168.1.14","TCP","60","443  >  63756 [ACK] Seq=429 Ack=6013 Win=1026 Len=0"
"259","4.122465","52.114.159.22","192.168.1.14","TLSv1.2","501","Application Data"
"266","4.165960","13.107.6.171","192.168.1.14","TCP","60","443  >  59734 [ACK] Seq=3771 Ack=154737 Win=2047 Len=0"
"267","4.167474","13.107.6.171","192.168.1.14","TCP","60","443  >  59734 [ACK] Seq=3771 Ack=155948 Win=2053 Len=0"
"268","4.169042","13.107.6.171","192.168.1.14","TCP","60","443  >  59734 [ACK] Seq=3771 Ack=157388 Win=2047 Len=0"
"269","4.170633","13.107.6.171","192.168.1.14","TCP","60","443  >  59734 [ACK] Seq=3771 Ack=158828 Win=2053 Len=0"
"270","4.171460","13.107.6.171","192.168.1.14","TCP","60","443  >  59734 [ACK] Seq=3771 Ack=158838 Win=2053 Len=0"
"271","4.173093","13.107.6.171","192.168.1.14","TCP","60","443  >  59734 [ACK] Seq=3771 Ack=160278 Win=2047 Len=0"
"272","4.174137","13.107.6.171","192.168.1.14","TCP","60","443  >  59734 [ACK] Seq=3771 Ack=161718 Win=2053 Len=0"
"273","4.174972","13.107.6.171","192.168.1.14","TCP","60","443  >  59734 [ACK] Seq=3771 Ack=161728 Win=2053 Len=0"
"274","4.175806","13.107.6.171","192.168.1.14","TCP","60","443  >  59734 [ACK] Seq=3771 Ack=162403 Win=2050 Len=0"
"275","4.182634","52.114.77.34","192.168.1.14","TCP","60","443  >  49989 [RST, ACK] Seq=1 Ack=1 Win=0 Len=0"
"276","4.244189","13.107.6.171","192.168.1.14","TLSv1.2","448","Application Data"
"277","4.244981","13.107.6.171","192.168.1.14","TLSv1.2","92","Application Data"
"282","4.306993","13.107.6.171","192.168.1.14","TCP","60","443  >  59734 [ACK] Seq=4203 Ack=163843 Win=2053 Len=0"
"283","4.308078","13.107.6.171","192.168.1.14","TCP","60","443  >  59734 [ACK] Seq=4203 Ack=165108 Win=2048 Len=0"
"284","4.309611","13.107.6.171","192.168.1.14","TCP","60","443  >  59734 [ACK] Seq=4203 Ack=166548 Win=2053 Len=0"
"285","4.310444","13.107.6.171","192.168.1.14","TCP","60","443  >  59734 [ACK] Seq=4203 Ack=166863 Win=2051 Len=0"
"286","4.312791","52.114.159.22","192.168.1.14","TCP","60","443  >  63756 [ACK] Seq=877 Ack=6014 Win=1026 Len=0"
"287","4.349720","13.107.6.171","192.168.1.14","TLSv1.2","400","Application Data"
"288","4.350510","13.107.6.171","192.168.1.14","TLSv1.2","92","Application Data"
"291","4.498633","2.21.57.60","192.168.1.14","TLSv1.2","85","Encrypted Alert"
"293","4.499484","2.21.57.60","192.168.1.14","TCP","60","443  >  63753 [FIN, ACK] Seq=32 Ack=1 Win=245 Len=0"
"295","4.529658","52.109.76.69","192.168.1.14","TLSv1.2","192","Application Data"
"296","4.547951","2.21.57.60","192.168.1.14","TCP","60","443  >  63753 [ACK] Seq=33 Ack=2 Win=245 Len=0"
"300","4.657489","13.107.6.171","192.168.1.14","TCP","60","443  >  59734 [ACK] Seq=4587 Ack=168089 Win=2053 Len=0"
"301","4.658324","13.107.6.171","192.168.1.14","TCP","60","443  >  59734 [ACK] Seq=4587 Ack=168673 Win=2050 Len=0"
"302","4.714190","13.107.6.171","192.168.1.14","TLSv1.2","524","Application Data"
"303","4.714965","13.107.6.171","192.168.1.14","TLSv1.2","145","Application Data"
"304","4.714966","13.107.6.171","192.168.1.14","TLSv1.2","92","Application Data"
"308","5.316011","52.109.76.69","192.168.1.14","TLSv1.2","79","Application Data"
"312","5.398334","13.107.6.171","192.168.1.14","TCP","60","443  >  59734 [ACK] Seq=5186 Ack=170113 Win=2053 Len=0"
"313","5.399762","13.107.6.171","192.168.1.14","TCP","60","443  >  59734 [ACK] Seq=5186 Ack=171348 Win=2048 Len=0"
"314","5.401598","13.107.6.171","192.168.1.14","TCP","60","443  >  59734 [ACK] Seq=5186 Ack=172788 Win=2053 Len=0"
"315","5.402431","13.107.6.171","192.168.1.14","TCP","60","443  >  59734 [ACK] Seq=5186 Ack=173103 Win=2051 Len=0"
"316","5.443847","13.107.6.171","192.168.1.14","TLSv1.2","380","Application Data"
"317","5.444625","13.107.6.171","192.168.1.14","TLSv1.2","92","Application Data"
"320","5.632414","52.109.76.69","192.168.1.14","TLSv1.2","192","Application Data"
"324","5.996403","13.107.6.171","192.168.1.14","TCP","60","443  >  59734 [ACK] Seq=5550 Ack=174329 Win=2053 Len=0"
"325","5.997238","13.107.6.171","192.168.1.14","TCP","60","443  >  59734 [ACK] Seq=5550 Ack=174918 Win=2050 Len=0"
"326","6.052768","13.107.6.171","192.168.1.14","TLSv1.2","550","Application Data"
"327","6.053549","13.107.6.171","192.168.1.14","TLSv1.2","92","Application Data"
"332","6.208158","13.107.6.171","192.168.1.14","TCP","60","443  >  59734 [ACK] Seq=6084 Ack=176358 Win=2053 Len=0"
"333","6.209596","13.107.6.171","192.168.1.14","TCP","60","443  >  59734 [ACK] Seq=6084 Ack=177593 Win=2048 Len=0"
"334","6.211844","13.107.6.171","192.168.1.14","TCP","60","443  >  59734 [ACK] Seq=6084 Ack=179033 Win=2053 Len=0"
"335","6.213589","13.107.6.171","192.168.1.14","TCP","60","443  >  59734 [ACK] Seq=6084 Ack=180483 Win=2047 Len=0"
"336","6.214610","13.107.6.171","192.168.1.14","TCP","60","443  >  59734 [ACK] Seq=6084 Ack=181923 Win=2053 Len=0"
"337","6.216283","13.107.6.171","192.168.1.14","TCP","60","443  >  59734 [ACK] Seq=6084 Ack=183353 Win=2047 Len=0"
"339","6.268697","13.107.6.171","192.168.1.14","TLSv1.2","486","Application Data"
"340","6.269480","13.107.6.171","192.168.1.14","TLSv1.2","92","Application Data"
"344","6.325187","13.107.6.171","192.168.1.14","TCP","60","443  >  59734 [ACK] Seq=6554 Ack=184793 Win=2053 Len=0"
"345","6.326458","13.107.6.171","192.168.1.14","TCP","60","443  >  59734 [ACK] Seq=6554 Ack=186058 Win=2048 Len=0"
"346","6.328391","13.107.6.171","192.168.1.14","TCP","60","443  >  59734 [ACK] Seq=6554 Ack=187498 Win=2053 Len=0"
"347","6.329225","13.107.6.171","192.168.1.14","TCP","60","443  >  59734 [ACK] Seq=6554 Ack=187813 Win=2051 Len=0"
"348","6.369605","13.107.6.171","192.168.1.14","TLSv1.2","374","Application Data"
"349","6.370385","13.107.6.171","192.168.1.14","TLSv1.2","92","Application Data"
"351","6.437750","52.114.159.22","192.168.1.14","TCP","66","443  >  59778 [SYN, ACK] Seq=0 Ack=1 Win=8192 Len=0 MSS=1440 WS=256 SACK_PERM=1"
"354","6.627610","52.114.159.22","192.168.1.14","TCP","1506","443  >  59778 [ACK] Seq=1 Ack=518 Win=262656 Len=1452 [TCP segment of a reassembled PDU]"
"355","6.628493","52.114.159.22","192.168.1.14","TCP","1506","443  >  59778 [ACK] Seq=1453 Ack=518 Win=262656 Len=1452 [TCP segment of a reassembled PDU]"
"357","6.629388","52.114.159.22","192.168.1.14","TCP","1506","443  >  59778 [ACK] Seq=2905 Ack=518 Win=262656 Len=1452 [TCP segment of a reassembled PDU]"
"358","6.629390","52.114.159.22","192.168.1.14","TCP","1506","443  >  59778 [ACK] Seq=4357 Ack=518 Win=262656 Len=1452 [TCP segment of a reassembled PDU]"
"359","6.629391","52.114.159.22","192.168.1.14","TLSv1.2","292","Server Hello, Certificate, Certificate Status, Server Key Exchange, Server Hello Done"
"362","6.818177","52.114.159.22","192.168.1.14","TLSv1.2","105","Change Cipher Spec, Encrypted Handshake Message"
"366","7.008975","52.114.159.22","192.168.1.14","TCP","60","443  >  59778 [ACK] Seq=6098 Ack=2880 Win=262656 Len=0"
"367","7.012342","52.114.159.22","192.168.1.14","TCP","60","443  >  59778 [ACK] Seq=6098 Ack=5760 Win=262656 Len=0"
"368","7.015832","52.114.159.22","192.168.1.14","TCP","60","443  >  59778 [ACK] Seq=6098 Ack=8640 Win=262656 Len=0"
"369","7.019278","52.114.159.22","192.168.1.14","TCP","60","443  >  59778 [ACK] Seq=6098 Ack=10459 Win=262656 Len=0"
"370","7.020153","52.114.159.22","192.168.1.14","TLSv1.2","482","Application Data"
"371","7.028928","52.109.76.69","192.168.1.14","TLSv1.2","192","Application Data"
"377","7.417227","13.107.6.171","192.168.1.14","TCP","60","443  >  59734 [ACK] Seq=6912 Ack=189253 Win=2053 Len=0"
"378","7.418600","13.107.6.171","192.168.1.14","TCP","60","443  >  59734 [ACK] Seq=6912 Ack=190518 Win=2048 Len=0"
"379","7.420525","13.107.6.171","192.168.1.14","TCP","60","443  >  59734 [ACK] Seq=6912 Ack=191958 Win=2053 Len=0"
"380","7.421911","13.107.6.171","192.168.1.14","TCP","60","443  >  59734 [ACK] Seq=6912 Ack=192273 Win=2051 Len=0"
"381","7.462403","13.107.6.171","192.168.1.14","TLSv1.2","421","Application Data"
"382","7.463186","13.107.6.171","192.168.1.14","TLSv1.2","92","Application Data"
"384","7.615704","95.101.114.212","192.168.1.14","TLSv1.2","85","Encrypted Alert"
"386","7.617278","95.101.114.212","192.168.1.14","TCP","60","443  >  63750 [FIN, ACK] Seq=32 Ack=1 Win=279 Len=0"
"388","7.660320","95.101.114.212","192.168.1.14","TCP","60","443  >  63750 [ACK] Seq=33 Ack=2 Win=279 Len=0"
"389","8.005411","95.101.114.212","192.168.1.14","TLSv1.2","85","Encrypted Alert"
"391","8.006269","95.101.114.212","192.168.1.14","TCP","60","443  >  63748 [FIN, ACK] Seq=32 Ack=1 Win=279 Len=0"
"393","8.047279","95.101.114.212","192.168.1.14","TCP","60","443  >  63748 [ACK] Seq=33 Ack=2 Win=279 Len=0"
"394","8.449433","2.21.48.168","192.168.1.14","TLSv1.2","78","Application Data"
"396","8.450308","2.21.48.168","192.168.1.14","TCP","60","443  >  63755 [FIN, ACK] Seq=25 Ack=1 Win=248 Len=0"
"400","8.498683","2.21.48.168","192.168.1.14","TCP","60","443  >  63755 [ACK] Seq=26 Ack=2 Win=248 Len=0"
"401","8.509873","13.107.6.171","192.168.1.14","TCP","60","443  >  59734 [ACK] Seq=7317 Ack=193713 Win=2053 Len=0"
"402","8.511931","13.107.6.171","192.168.1.14","TCP","60","443  >  59734 [ACK] Seq=7317 Ack=194978 Win=2048 Len=0"
"403","8.513273","13.107.6.171","192.168.1.14","TCP","60","443  >  59734 [ACK] Seq=7317 Ack=196418 Win=2053 Len=0"
"404","8.514109","13.107.6.171","192.168.1.14","TCP","60","443  >  59734 [ACK] Seq=7317 Ack=196733 Win=2051 Len=0"
"405","8.555694","13.107.6.171","192.168.1.14","TLSv1.2","382","Application Data"
"406","8.556478","13.107.6.171","192.168.1.14","TLSv1.2","92","Application Data"
"411","8.691592","13.107.6.171","192.168.1.14","TCP","60","443  >  59734 [ACK] Seq=7683 Ack=198173 Win=2053 Len=0"
"412","8.692926","13.107.6.171","192.168.1.14","TCP","60","443  >  59734 [ACK] Seq=7683 Ack=199438 Win=2048 Len=0"
"413","8.694544","13.107.6.171","192.168.1.14","TCP","60","443  >  59734 [ACK] Seq=7683 Ack=200878 Win=2053 Len=0"
"414","8.696451","13.107.6.171","192.168.1.14","TCP","60","443  >  59734 [ACK] Seq=7683 Ack=202318 Win=2047 Len=0"
"415","8.697222","13.107.6.171","192.168.1.14","TCP","60","443  >  59734 [ACK] Seq=7683 Ack=202328 Win=2047 Len=0"
"416","8.698057","13.107.6.171","192.168.1.14","TCP","60","443  >  59734 [ACK] Seq=7683 Ack=203768 Win=2053 Len=0"
"417","8.698889","13.107.6.171","192.168.1.14","TCP","60","443  >  59734 [ACK] Seq=7683 Ack=203785 Win=2053 Len=0"
"418","8.753064","13.107.6.171","192.168.1.14","TLSv1.2","420","Application Data"
"419","8.753849","13.107.6.171","192.168.1.14","TLSv1.2","92","Application Data"
"423","8.799786","13.107.6.171","192.168.1.14","TCP","60","443  >  59734 [ACK] Seq=8087 Ack=205225 Win=2053 Len=0"
"424","8.800798","13.107.6.171","192.168.1.14","TCP","60","443  >  59734 [ACK] Seq=8087 Ack=206490 Win=2048 Len=0"
"425","8.802573","13.107.6.171","192.168.1.14","TCP","60","443  >  59734 [ACK] Seq=8087 Ack=207930 Win=2053 Len=0"
"426","8.803319","13.107.6.171","192.168.1.14","TCP","60","443  >  59734 [ACK] Seq=8087 Ack=208245 Win=2051 Len=0"
"427","8.845714","13.107.6.171","192.168.1.14","TLSv1.2","374","Application Data"
"428","8.846502","13.107.6.171","192.168.1.14","TLSv1.2","92","Application Data"
"435","9.896020","13.107.6.171","192.168.1.14","TCP","60","443  >  59734 [ACK] Seq=8445 Ack=209685 Win=2053 Len=0"
"436","9.897794","13.107.6.171","192.168.1.14","TCP","60","443  >  59734 [ACK] Seq=8445 Ack=210950 Win=2048 Len=0"
"437","9.899709","13.107.6.171","192.168.1.14","TCP","60","443  >  59734 [ACK] Seq=8445 Ack=212390 Win=2053 Len=0"
"438","9.900543","13.107.6.171","192.168.1.14","TCP","60","443  >  59734 [ACK] Seq=8445 Ack=212705 Win=2051 Len=0"
"439","9.951506","13.107.6.171","192.168.1.14","TLSv1.2","396","Application Data"
"440","9.952282","13.107.6.171","192.168.1.14","TLSv1.2","92","Application Data"
"442","10.385313","2.21.48.168","192.168.1.14","TLSv1.2","78","Application Data"
"444","10.386162","2.21.48.168","192.168.1.14","TCP","60","443  >  63754 [FIN, ACK] Seq=25 Ack=1 Win=267 Len=0"
"446","10.435591","2.21.48.168","192.168.1.14","TCP","60","443  >  63754 [ACK] Seq=26 Ack=2 Win=267 Len=0"
"449","10.577290","13.107.6.171","192.168.1.14","TCP","60","443  >  59734 [ACK] Seq=8825 Ack=213931 Win=2053 Len=0"
"450","10.578316","13.107.6.171","192.168.1.14","TCP","60","443  >  59734 [ACK] Seq=8825 Ack=214526 Win=2050 Len=0"
"454","10.687587","13.107.6.171","192.168.1.14","TLSv1.2","484","Application Data"
"455","10.688373","13.107.6.171","192.168.1.14","TLSv1.2","290","Application Data"
"456","10.688374","13.107.6.171","192.168.1.14","TLSv1.2","92","Application Data"
"458","10.698909","13.107.6.171","192.168.1.14","TCP","60","443  >  59734 [ACK] Seq=9529 Ack=215966 Win=2053 Len=0"
"459","10.700784","13.107.6.171","192.168.1.14","TCP","60","443  >  59734 [ACK] Seq=9529 Ack=217201 Win=2048 Len=0"
"460","10.702335","13.107.6.171","192.168.1.14","TCP","60","443  >  59734 [ACK] Seq=9529 Ack=218641 Win=2053 Len=0"
"461","10.706038","13.107.6.171","192.168.1.14","TCP","60","443  >  59734 [ACK] Seq=9529 Ack=220081 Win=2047 Len=0"
"462","10.706870","13.107.6.171","192.168.1.14","TCP","60","443  >  59734 [ACK] Seq=9529 Ack=220091 Win=2047 Len=0"
"463","10.706871","13.107.6.171","192.168.1.14","TCP","60","443  >  59734 [ACK] Seq=9529 Ack=221262 Win=2053 Len=0"
"464","10.758996","13.107.6.171","192.168.1.14","TLSv1.2","544","Application Data"
"465","10.759778","13.107.6.171","192.168.1.14","TLSv1.2","92","Application Data"
"469","10.817386","13.107.6.171","192.168.1.14","TCP","60","443  >  59734 [ACK] Seq=10057 Ack=222702 Win=2047 Len=0"
"470","10.819074","13.107.6.171","192.168.1.14","TCP","60","443  >  59734 [ACK] Seq=10057 Ack=223967 Win=2053 Len=0"
"471","10.820688","13.107.6.171","192.168.1.14","TCP","60","443  >  59734 [ACK] Seq=10057 Ack=225407 Win=2047 Len=0"
"472","10.821480","13.107.6.171","192.168.1.14","TCP","60","443  >  59734 [ACK] Seq=10057 Ack=225722 Win=2053 Len=0"
"473","10.860489","13.107.6.171","192.168.1.14","TLSv1.2","437","Application Data"
"474","10.861272","13.107.6.171","192.168.1.14","TLSv1.2","92","Application Data"
"476","10.920620","54.229.206.207","192.168.1.14","TLSv1.2","419","Application Data"
"477","10.921406","54.229.206.207","192.168.1.14","TLSv1.2","88","Application Data"
"478","10.921407","54.229.206.207","192.168.1.14","TLSv1.2","85","Encrypted Alert"
"479","10.921408","54.229.206.207","192.168.1.14","TCP","60","443  >  59776 [FIN, ACK] Seq=431 Ack=1 Win=229 Len=0"
"483","10.984713","54.229.206.207","192.168.1.14","TCP","60","443  >  59776 [ACK] Seq=432 Ack=2 Win=229 Len=0"
"484","10.992658","54.229.206.207","192.168.1.14","TCP","66","443  >  59779 [SYN, ACK] Seq=0 Ack=1 Win=26883 Len=0 MSS=1452 SACK_PERM=1 WS=128"
"487","11.000666","13.107.18.11","192.168.1.14","TLSv1.2","102","Application Data"
"488","11.003344","13.107.18.11","192.168.1.14","TLSv1.2","102","Application Data"
"490","11.060953","54.229.206.207","192.168.1.14","TLSv1.2","191","Server Hello, Change Cipher Spec, Encrypted Handshake Message"
"493","11.126948","54.229.206.207","192.168.1.14","TCP","60","443  >  59779 [ACK] Seq=138 Ack=1189 Win=29312 Len=0"
"498","11.525736","18.214.185.18","192.168.1.14","TLSv1.2","85","Application Data"
"503","11.923164","13.107.6.171","192.168.1.14","TCP","60","443  >  59734 [ACK] Seq=10478 Ack=227162 Win=2047 Len=0"
"504","11.924357","13.107.6.171","192.168.1.14","TCP","60","443  >  59734 [ACK] Seq=10478 Ack=228427 Win=2053 Len=0"
"505","11.926319","13.107.6.171","192.168.1.14","TCP","60","443  >  59734 [ACK] Seq=10478 Ack=229867 Win=2047 Len=0"
"506","11.927153","13.107.6.171","192.168.1.14","TCP","60","443  >  59734 [ACK] Seq=10478 Ack=230182 Win=2053 Len=0"
"507","11.941322","52.109.76.69","192.168.1.14","TLSv1.2","192","Application Data"
"508","11.968553","13.107.6.171","192.168.1.14","TLSv1.2","390","Application Data"
"509","11.969325","13.107.6.171","192.168.1.14","TLSv1.2","181","Application Data"
"510","11.969326","13.107.6.171","192.168.1.14","TLSv1.2","92","Application Data"
"515","12.091936","13.107.6.171","192.168.1.14","TCP","60","443  >  59734 [ACK] Seq=10979 Ack=231622 Win=2047 Len=0"
"516","12.093552","13.107.6.171","192.168.1.14","TCP","60","443  >  59734 [ACK] Seq=10979 Ack=232887 Win=2053 Len=0"
"517","12.095311","13.107.6.171","192.168.1.14","TCP","60","443  >  59734 [ACK] Seq=10979 Ack=234327 Win=2047 Len=0"
"518","12.096145","13.107.6.171","192.168.1.14","TCP","60","443  >  59734 [ACK] Seq=10979 Ack=234703 Win=2053 Len=0"
"519","12.096146","13.107.6.171","192.168.1.14","TLSv1.2","96","Application Data"
"521","12.260792","13.107.6.171","192.168.1.14","TLSv1.2","365","Application Data"
"522","12.261573","13.107.6.171","192.168.1.14","TLSv1.2","92","Application Data"
"526","12.458417","13.107.6.171","192.168.1.14","TCP","60","443  >  59734 [ACK] Seq=11370 Ack=235929 Win=2048 Len=0"
"527","12.460057","13.107.6.171","192.168.1.14","TCP","60","443  >  59734 [ACK] Seq=11370 Ack=236531 Win=2053 Len=0"
"528","12.556835","13.107.6.171","192.168.1.14","TLSv1.2","717","Application Data"
"529","12.557618","13.107.6.171","192.168.1.14","TLSv1.2","92","Application Data"
"535","12.722012","13.107.6.171","192.168.1.14","TCP","60","443  >  59734 [ACK] Seq=12071 Ack=237971 Win=2047 Len=0"
"536","12.722876","13.107.6.171","192.168.1.14","TCP","60","443  >  59734 [ACK] Seq=12071 Ack=239206 Win=2053 Len=0"
"537","12.724745","13.107.6.171","192.168.1.14","TCP","60","443  >  59734 [ACK] Seq=12071 Ack=240646 Win=2047 Len=0"
"538","12.726807","13.107.6.171","192.168.1.14","TCP","60","443  >  59734 [ACK] Seq=12071 Ack=242096 Win=2053 Len=0"
"539","12.728300","13.107.6.171","192.168.1.14","TCP","60","443  >  59734 [ACK] Seq=12071 Ack=243536 Win=2047 Len=0"
"540","12.730987","13.107.6.171","192.168.1.14","TCP","60","443  >  59734 [ACK] Seq=12071 Ack=244976 Win=2053 Len=0"
"541","12.731771","13.107.6.171","192.168.1.14","TCP","60","443  >  59734 [ACK] Seq=12071 Ack=244986 Win=2053 Len=0"
"542","12.731771","13.107.6.171","192.168.1.14","TCP","60","443  >  59734 [ACK] Seq=12071 Ack=245265 Win=2052 Len=0"
"543","12.784288","13.107.6.171","192.168.1.14","TLSv1.2","388","Application Data"
"544","12.785087","13.107.6.171","192.168.1.14","TLSv1.2","92","Application Data"
"548","12.856475","13.107.6.171","192.168.1.14","TCP","60","443  >  59734 [ACK] Seq=12443 Ack=246705 Win=2053 Len=0"
"549","12.857720","13.107.6.171","192.168.1.14","TCP","60","443  >  59734 [ACK] Seq=12443 Ack=247970 Win=2048 Len=0"
"550","12.859756","13.107.6.171","192.168.1.14","TCP","60","443  >  59734 [ACK] Seq=12443 Ack=249410 Win=2053 Len=0"
"551","12.860590","13.107.6.171","192.168.1.14","TCP","60","443  >  59734 [ACK] Seq=12443 Ack=249725 Win=2051 Len=0"
"552","12.902960","13.107.6.171","192.168.1.14","TLSv1.2","409","Application Data"
"553","12.903744","13.107.6.171","192.168.1.14","TLSv1.2","92","Application Data"
"557","12.981799","2.21.55.84","192.168.1.14","TCP","66","443  >  53317 [ACK] Seq=1 Ack=2 Win=249 Len=0 SLE=1 SRE=2"
"558","13.012732","2.21.55.84","192.168.1.14","TCP","66","443  >  53318 [ACK] Seq=1 Ack=2 Win=249 Len=0 SLE=1 SRE=2"
"560","13.215723","52.109.76.69","192.168.1.14","TLSv1.2","192","Application Data"
"564","13.515896","31.13.84.51","192.168.1.14","TCP","60","443  >  49982 [ACK] Seq=1 Ack=32 Win=214 Len=0"
"566","13.626565","31.13.84.51","192.168.1.14","TLSv1.2","92","Application Data"
"568","13.675701","2.21.55.84","192.168.1.14","TCP","66","443  >  53321 [ACK] Seq=1 Ack=2 Win=250 Len=0 SLE=1 SRE=2"
"570","13.818672","2.21.55.84","192.168.1.14","TCP","66","443  >  53320 [ACK] Seq=1 Ack=2 Win=250 Len=0 SLE=1 SRE=2"
"572","13.891352","13.107.136.13","192.168.1.14","TCP","66","443  >  53319 [ACK] Seq=1 Ack=2 Win=1025 Len=0 SLE=1 SRE=2"
"575","13.955148","13.107.6.171","192.168.1.14","TCP","60","443  >  59734 [ACK] Seq=12836 Ack=251165 Win=2053 Len=0"
"576","13.956870","13.107.6.171","192.168.1.14","TCP","60","443  >  59734 [ACK] Seq=12836 Ack=252430 Win=2048 Len=0"
"577","13.958732","13.107.6.171","192.168.1.14","TCP","60","443  >  59734 [ACK] Seq=12836 Ack=253870 Win=2053 Len=0"
"578","13.959578","13.107.6.171","192.168.1.14","TCP","60","443  >  59734 [ACK] Seq=12836 Ack=254185 Win=2051 Len=0"
"579","14.002531","13.107.6.171","192.168.1.14","TLSv1.2","396","Application Data"
"580","14.003314","13.107.6.171","192.168.1.14","TLSv1.2","92","Application Data"
"585","14.874062","13.107.6.171","192.168.1.14","TCP","60","443  >  59734 [ACK] Seq=13216 Ack=255625 Win=2053 Len=0"
"586","14.875736","13.107.6.171","192.168.1.14","TCP","60","443  >  59734 [ACK] Seq=13216 Ack=256890 Win=2048 Len=0"
"587","14.877193","13.107.6.171","192.168.1.14","TCP","60","443  >  59734 [ACK] Seq=13216 Ack=258330 Win=2053 Len=0"
"588","14.879596","13.107.6.171","192.168.1.14","TCP","60","443  >  59734 [ACK] Seq=13216 Ack=259780 Win=2047 Len=0"
"589","14.880686","13.107.6.171","192.168.1.14","TCP","60","443  >  59734 [ACK] Seq=13216 Ack=260912 Win=2053 Len=0"
"590","14.936500","13.107.6.171","192.168.1.14","TLSv1.2","313","Application Data"
"591","14.937560","13.107.6.171","192.168.1.14","TLSv1.2","186","Application Data"
"592","14.937561","13.107.6.171","192.168.1.14","TLSv1.2","92","Application Data"
"596","14.991931","13.107.6.171","192.168.1.14","TCP","60","443  >  59734 [ACK] Seq=13645 Ack=262352 Win=2047 Len=0"
