"No.","Time","Source","Destination","Protocol","Length","Info"
"2","0.665451","192.168.1.14","192.168.1.1","DNS","83","Standard query 0x7de6 A ctldl.windowsupdate.com"
"3","0.694204","192.168.1.1","192.168.1.14","DNS","534","Standard query response 0x7de6 A ctldl.windowsupdate.com CNAME audownload.windowsupdate.nsatc.net CNAME au.download.windowsupdate.com.edgesuite.net CNAME a767.dscg3.akamai.net A 104.77.185.19 A 104.77.185.25 A 95.101.114.90 A 95.101.114.91 A 104.77.185.24 A 104.77.185.42 A 95.101.114.97 A 104.77.185.66 A 95.101.114.82 NS n1dscg3.AkAMaI.net NS n3dscg3.AkAMaI.net NS n0dscg3.AkAMaI.net NS n4dscg3.AkAMaI.net NS n2dscg3.AkAMaI.net NS n5dscg3.AkAMaI.net"
"4","0.694542","192.168.1.14","192.168.1.1","TCP","66","56464  >  53 [SYN] Seq=0 Win=64240 Len=0 MSS=1460 WS=256 SACK_PERM=1"
"5","0.696679","192.168.1.1","192.168.1.14","TCP","66","53  >  56464 [SYN, ACK] Seq=0 Ack=1 Win=5840 Len=0 MSS=1460 SACK_PERM=1 WS=4"
"6","0.696744","192.168.1.14","192.168.1.1","TCP","54","56464  >  53 [ACK] Seq=1 Ack=1 Win=131328 Len=0"
"7","0.696806","192.168.1.14","192.168.1.1","DNS","97","Standard query 0x7de6 A ctldl.windowsupdate.com"
"8","0.698765","192.168.1.1","192.168.1.14","TCP","60","53  >  56464 [ACK] Seq=1 Ack=44 Win=5840 Len=0"
"9","0.771245","192.168.1.1","192.168.1.14","TCP","60","53  >  56464 [PSH, ACK] Seq=1 Ack=44 Win=5840 Len=1 [TCP segment of a reassembled PDU]"
"10","0.811457","192.168.1.14","192.168.1.1","TCP","54","56464  >  53 [ACK] Seq=44 Ack=2 Win=131328 Len=0"
"11","0.813698","192.168.1.1","192.168.1.14","DNS","744","Standard query response 0x7de6 A ctldl.windowsupdate.com CNAME audownload.windowsupdate.nsatc.net CNAME au.download.windowsupdate.com.edgesuite.net CNAME a767.dscg3.akamai.net A 95.101.114.97 A 95.101.114.82 A 104.77.185.19 A 104.77.185.24 A 104.77.185.66 A 95.101.114.90 A 95.101.114.91 A 104.77.185.42 A 104.77.185.25 NS n1dscg3.AkAMaI.net NS n5dscg3.AkAMaI.net NS n4dscg3.AkAMaI.net NS n3dscg3.AkAMaI.net NS n0dscg3.AkAMaI.net NS n6dscg3.AkAMaI.net NS n2dscg3.AkAMaI.net NS n7dscg3.AkAMaI.net A 88.221.81.192 A 84.53.161.180 A 84.53.161.173 A 104.96.90.238 A 84.53.161.182 A 2.20.252.142 A 84.53.161.237 A 23.6.112.182 AAAA 2600:1480:e800::c0"
"12","0.813845","192.168.1.14","192.168.1.1","TCP","54","56464  >  53 [FIN, ACK] Seq=44 Ack=692 Win=130560 Len=0"
"13","0.815842","192.168.1.1","192.168.1.14","TCP","60","53  >  56464 [FIN, ACK] Seq=692 Ack=45 Win=5840 Len=0"
"14","0.815879","192.168.1.14","192.168.1.1","TCP","54","56464  >  53 [ACK] Seq=45 Ack=693 Win=130560 Len=0"
"15","0.816970","192.168.1.14","95.101.114.97","TCP","66","56465  >  80 [SYN] Seq=0 Win=64240 Len=0 MSS=1460 WS=256 SACK_PERM=1"
"16","0.873344","95.101.114.97","192.168.1.14","TCP","66","80  >  56465 [SYN, ACK] Seq=0 Ack=1 Win=29200 Len=0 MSS=1452 SACK_PERM=1 WS=128"
"17","0.873421","192.168.1.14","95.101.114.97","TCP","54","56465  >  80 [ACK] Seq=1 Ack=1 Win=132096 Len=0"
"18","0.873529","192.168.1.14","95.101.114.97","HTTP","335","GET /msdownload/update/v3/static/trustedr/en/authrootstl.cab?ec6e5ceaa7fa52e0 HTTP/1.1 "
"19","0.927305","95.101.114.97","192.168.1.14","TCP","60","80  >  56465 [ACK] Seq=1 Ack=282 Win=30336 Len=0"
"20","0.928483","95.101.114.97","192.168.1.14","HTTP","322","HTTP/1.1 304 Not Modified "
"21","0.936137","192.168.1.14","192.168.1.1","DNS","78","Standard query 0xb0ed A crl.globalsign.net"
"22","0.964026","192.168.1.1","192.168.1.14","DNS","530","Standard query response 0xb0ed A crl.globalsign.net CNAME global.prd.cdn.globalsign.com CNAME cdn.globalsigncdn.com.cdn.cloudflare.net A 104.18.21.226 A 104.18.20.226 NS ns3.cloudflare.net NS ns2.cloudflare.net NS ns1.cloudflare.net NS ns5.cloudflare.net NS ns4.cloudflare.net A 173.245.59.31 A 198.41.222.131 A 198.41.222.31 A 198.41.223.131 A 198.41.223.31 AAAA 2400:cb00:2049:1::adf5:3b1f AAAA 2400:cb00:2049:1::c629:de83 AAAA 2400:cb00:2049:1::c629:de1f AAAA 2400:cb00:2049:1::c629:df83"
"23","0.964652","192.168.1.14","104.18.21.226","TCP","66","56467  >  80 [SYN] Seq=0 Win=64240 Len=0 MSS=1460 WS=256 SACK_PERM=1"
"24","0.968280","192.168.1.14","95.101.114.97","TCP","54","56465  >  80 [ACK] Seq=282 Ack=269 Win=131840 Len=0"
"25","0.990111","104.18.21.226","192.168.1.14","TCP","66","80  >  56467 [SYN, ACK] Seq=0 Ack=1 Win=65535 Len=0 MSS=1400 SACK_PERM=1 WS=1024"
"26","0.990192","192.168.1.14","104.18.21.226","TCP","54","56467  >  80 [ACK] Seq=1 Ack=1 Win=131584 Len=0"
"27","0.990311","192.168.1.14","104.18.21.226","HTTP","265","GET /root-r2.crl HTTP/1.1 "
"28","1.013463","104.18.21.226","192.168.1.14","TCP","60","80  >  56467 [ACK] Seq=1 Ack=212 Win=67584 Len=0"
"29","1.052635","104.18.21.226","192.168.1.14","HTTP","478","HTTP/1.1 304 Not Modified "
"30","1.061356","192.168.1.14","95.101.114.97","HTTP","336","GET /msdownload/update/v3/static/trustedr/en/pinrulesstl.cab?1cd7407fec8e0e78 HTTP/1.1 "
"31","1.092755","192.168.1.14","104.18.21.226","TCP","54","56467  >  80 [ACK] Seq=212 Ack=425 Win=131072 Len=0"
"32","1.117607","95.101.114.97","192.168.1.14","HTTP","325","HTTP/1.1 304 Not Modified "
"33","1.157137","192.168.1.14","95.101.114.97","TCP","54","56465  >  80 [ACK] Seq=564 Ack=540 Win=131584 Len=0"
"36","2.073359","192.168.1.14","95.216.155.62","TCP","66","56468  >  443 [SYN] Seq=0 Win=64240 Len=0 MSS=1460 WS=256 SACK_PERM=1"
"37","2.139159","95.216.155.62","192.168.1.14","TCP","66","443  >  56468 [SYN, ACK] Seq=0 Ack=1 Win=64240 Len=0 MSS=1452 SACK_PERM=1 WS=128"
"38","2.139252","192.168.1.14","95.216.155.62","TCP","54","56468  >  443 [ACK] Seq=1 Ack=1 Win=132096 Len=0"
"39","2.139567","192.168.1.14","95.216.155.62","TLSv1.2","571","Client Hello"
"40","2.206914","95.216.155.62","192.168.1.14","TCP","60","443  >  56468 [ACK] Seq=1 Ack=518 Win=64128 Len=0"
"41","2.207769","95.216.155.62","192.168.1.14","TLSv1.2","202","Server Hello, Change Cipher Spec, Encrypted Handshake Message"
"42","2.208637","192.168.1.14","95.216.155.62","TLSv1.2","97","Change Cipher Spec, Encrypted Handshake Message"
"43","2.208857","192.168.1.14","95.216.155.62","TLSv1.2","749","Application Data"
"44","2.277257","95.216.155.62","192.168.1.14","TCP","60","443  >  56468 [ACK] Seq=149 Ack=1256 Win=64128 Len=0"
"45","2.281221","192.168.1.14","44.226.133.70","TLSv1.2","135","Application Data"
"46","2.281284","192.168.1.14","44.226.133.70","TLSv1.2","100","Application Data"
"47","2.281317","192.168.1.14","44.226.133.70","TLSv1.2","1356","Application Data"
"49","2.492562","44.226.133.70","192.168.1.14","TCP","60","443  >  51488 [ACK] Seq=1 Ack=82 Win=125 Len=0"
"50","2.493350","44.226.133.70","192.168.1.14","TCP","60","443  >  51488 [ACK] Seq=1 Ack=128 Win=125 Len=0"
"51","2.493351","44.226.133.70","192.168.1.14","TLSv1.2","100","Application Data"
"52","2.500316","44.226.133.70","192.168.1.14","TLSv1.2","519","Application Data"
"53","2.500351","192.168.1.14","44.226.133.70","TCP","54","51488  >  443 [ACK] Seq=1430 Ack=512 Win=516 Len=0"
"54","2.501128","44.226.133.70","192.168.1.14","TLSv1.2","92","Application Data"
"55","2.541859","192.168.1.14","44.226.133.70","TCP","54","51488  >  443 [ACK] Seq=1430 Ack=550 Win=515 Len=0"
"56","2.625202","192.168.1.14","18.235.97.175","TLSv1.2","85","Application Data"
"57","2.695253","95.216.155.62","192.168.1.14","TCP","1506","443  >  56468 [ACK] Seq=149 Ack=1256 Win=64128 Len=1452 [TCP segment of a reassembled PDU]"
"58","2.696137","95.216.155.62","192.168.1.14","TCP","1506","443  >  56468 [ACK] Seq=1601 Ack=1256 Win=64128 Len=1452 [TCP segment of a reassembled PDU]"
"59","2.696138","95.216.155.62","192.168.1.14","TCP","1506","443  >  56468 [ACK] Seq=3053 Ack=1256 Win=64128 Len=1452 [TCP segment of a reassembled PDU]"
"60","2.696183","192.168.1.14","95.216.155.62","TCP","54","56468  >  443 [ACK] Seq=1256 Ack=4505 Win=132096 Len=0"
"61","2.697033","95.216.155.62","192.168.1.14","TCP","1506","443  >  56468 [ACK] Seq=4505 Ack=1256 Win=64128 Len=1452 [TCP segment of a reassembled PDU]"
"62","2.697034","95.216.155.62","192.168.1.14","TCP","1506","443  >  56468 [ACK] Seq=5957 Ack=1256 Win=64128 Len=1452 [TCP segment of a reassembled PDU]"
"63","2.697085","192.168.1.14","95.216.155.62","TCP","54","56468  >  443 [ACK] Seq=1256 Ack=7409 Win=132096 Len=0"
"64","2.698750","95.216.155.62","192.168.1.14","TCP","1506","443  >  56468 [ACK] Seq=7409 Ack=1256 Win=64128 Len=1452 [TCP segment of a reassembled PDU]"
"65","2.698795","192.168.1.14","95.216.155.62","TCP","54","56468  >  443 [ACK] Seq=1256 Ack=8861 Win=132096 Len=0"
"66","2.699643","95.216.155.62","192.168.1.14","TCP","1506","443  >  56468 [ACK] Seq=8861 Ack=1256 Win=64128 Len=1452 [TCP segment of a reassembled PDU]"
"67","2.699644","95.216.155.62","192.168.1.14","TCP","1506","443  >  56468 [ACK] Seq=10313 Ack=1256 Win=64128 Len=1452 [TCP segment of a reassembled PDU]"
"68","2.699645","95.216.155.62","192.168.1.14","TCP","1506","443  >  56468 [ACK] Seq=11765 Ack=1256 Win=64128 Len=1452 [TCP segment of a reassembled PDU]"
"69","2.699647","95.216.155.62","192.168.1.14","TCP","1506","443  >  56468 [ACK] Seq=13217 Ack=1256 Win=64128 Len=1452 [TCP segment of a reassembled PDU]"
"70","2.699702","192.168.1.14","95.216.155.62","TCP","54","56468  >  443 [ACK] Seq=1256 Ack=14669 Win=132096 Len=0"
"71","2.757604","18.235.97.175","192.168.1.14","TLSv1.2","85","Application Data"
"72","2.761848","95.216.155.62","192.168.1.14","TCP","1506","443  >  56468 [ACK] Seq=14669 Ack=1256 Win=64128 Len=1452 [TCP segment of a reassembled PDU]"
"73","2.764355","95.216.155.62","192.168.1.14","TLSv1.2","1506","Application Data [TCP segment of a reassembled PDU]"
"74","2.764401","192.168.1.14","95.216.155.62","TCP","54","56468  >  443 [ACK] Seq=1256 Ack=17573 Win=132096 Len=0"
"75","2.765185","95.216.155.62","192.168.1.14","TCP","1506","443  >  56468 [ACK] Seq=17573 Ack=1256 Win=64128 Len=1452 [TCP segment of a reassembled PDU]"
"76","2.765947","95.216.155.62","192.168.1.14","TCP","1506","443  >  56468 [ACK] Seq=19025 Ack=1256 Win=64128 Len=1452 [TCP segment of a reassembled PDU]"
"77","2.765949","95.216.155.62","192.168.1.14","TCP","1506","443  >  56468 [ACK] Seq=20477 Ack=1256 Win=64128 Len=1452 [TCP segment of a reassembled PDU]"
"78","2.765949","95.216.155.62","192.168.1.14","TCP","1506","443  >  56468 [ACK] Seq=21929 Ack=1256 Win=64128 Len=1452 [TCP segment of a reassembled PDU]"
"79","2.765951","95.216.155.62","192.168.1.14","TCP","1506","443  >  56468 [ACK] Seq=23381 Ack=1256 Win=64128 Len=1452 [TCP segment of a reassembled PDU]"
"80","2.765951","95.216.155.62","192.168.1.14","TCP","1506","443  >  56468 [ACK] Seq=24833 Ack=1256 Win=64128 Len=1452 [TCP segment of a reassembled PDU]"
"81","2.765981","192.168.1.14","95.216.155.62","TCP","54","56468  >  443 [ACK] Seq=1256 Ack=26285 Win=132096 Len=0"
"82","2.767585","95.216.155.62","192.168.1.14","TCP","1506","443  >  56468 [ACK] Seq=26285 Ack=1256 Win=64128 Len=1452 [TCP segment of a reassembled PDU]"
"83","2.767586","95.216.155.62","192.168.1.14","TCP","1506","443  >  56468 [ACK] Seq=27737 Ack=1256 Win=64128 Len=1452 [TCP segment of a reassembled PDU]"
"84","2.767586","95.216.155.62","192.168.1.14","TCP","1506","443  >  56468 [ACK] Seq=29189 Ack=1256 Win=64128 Len=1452 [TCP segment of a reassembled PDU]"
"85","2.767588","95.216.155.62","192.168.1.14","TCP","1506","443  >  56468 [ACK] Seq=30641 Ack=1256 Win=64128 Len=1452 [TCP segment of a reassembled PDU]"
"86","2.767588","95.216.155.62","192.168.1.14","TLSv1.2","1506","Application Data [TCP segment of a reassembled PDU]"
"87","2.767628","192.168.1.14","95.216.155.62","TCP","54","56468  >  443 [ACK] Seq=1256 Ack=33545 Win=132096 Len=0"
"88","2.768434","95.216.155.62","192.168.1.14","TCP","1506","443  >  56468 [ACK] Seq=33545 Ack=1256 Win=64128 Len=1452 [TCP segment of a reassembled PDU]"
"89","2.768466","192.168.1.14","95.216.155.62","TCP","54","56468  >  443 [ACK] Seq=1256 Ack=34997 Win=132096 Len=0"
"90","2.770121","95.216.155.62","192.168.1.14","TCP","1506","443  >  56468 [ACK] Seq=34997 Ack=1256 Win=64128 Len=1452 [TCP segment of a reassembled PDU]"
"91","2.770126","95.216.155.62","192.168.1.14","TCP","1506","443  >  56468 [ACK] Seq=36449 Ack=1256 Win=64128 Len=1452 [TCP segment of a reassembled PDU]"
"92","2.770135","95.216.155.62","192.168.1.14","TCP","1506","443  >  56468 [ACK] Seq=37901 Ack=1256 Win=64128 Len=1452 [TCP segment of a reassembled PDU]"
"93","2.770138","95.216.155.62","192.168.1.14","TCP","1506","443  >  56468 [ACK] Seq=39353 Ack=1256 Win=64128 Len=1452 [TCP segment of a reassembled PDU]"
"94","2.770303","192.168.1.14","95.216.155.62","TCP","54","56468  >  443 [ACK] Seq=1256 Ack=40805 Win=132096 Len=0"
"95","2.771122","95.216.155.62","192.168.1.14","TCP","1506","443  >  56468 [ACK] Seq=40805 Ack=1256 Win=64128 Len=1452 [TCP segment of a reassembled PDU]"
"96","2.771123","95.216.155.62","192.168.1.14","TCP","1506","443  >  56468 [ACK] Seq=42257 Ack=1256 Win=64128 Len=1452 [TCP segment of a reassembled PDU]"
"97","2.771154","192.168.1.14","95.216.155.62","TCP","54","56468  >  443 [ACK] Seq=1256 Ack=43709 Win=132096 Len=0"
"98","2.798430","192.168.1.14","18.235.97.175","TCP","54","49655  >  8884 [ACK] Seq=32 Ack=32 Win=32163 Len=0"
"99","2.834413","95.216.155.62","192.168.1.14","TCP","1506","443  >  56468 [ACK] Seq=43709 Ack=1256 Win=64128 Len=1452 [TCP segment of a reassembled PDU]"
"100","2.835304","95.216.155.62","192.168.1.14","TCP","1506","443  >  56468 [ACK] Seq=45161 Ack=1256 Win=64128 Len=1452 [TCP segment of a reassembled PDU]"
"101","2.835305","95.216.155.62","192.168.1.14","TLSv1.2","1386","Application Data"
"102","2.835342","192.168.1.14","95.216.155.62","TCP","54","56468  >  443 [ACK] Seq=1256 Ack=47945 Win=132096 Len=0"
"103","3.122751","192.168.1.14","192.168.1.1","DNS","78","Standard query 0x5717 A twemoji.maxcdn.com"
"104","3.128008","192.168.1.14","95.216.155.62","TLSv1.2","764","Application Data"
"105","3.149276","192.168.1.1","192.168.1.14","DNS","529","Standard query response 0x5717 A twemoji.maxcdn.com CNAME emoji.twemoji.netdna-cdn.com A 23.111.9.57 NS ns-1716.awsdns-22.co.uk NS ns-946.awsdns-54.net NS dns3.p04.nsone.net NS dns4.p04.nsone.net NS ns-97.awsdns-12.com NS dns1.p04.nsone.net NS dns2.p04.nsone.net NS ns-1326.awsdns-37.org A 198.51.44.4 A 198.51.45.4 A 198.51.44.68 A 198.51.45.68 A 205.251.197.46 A 205.251.198.180 A 205.251.195.178 A 205.251.192.97 AAAA 2600:9000:5305:2e00::1"
"106","3.150038","192.168.1.14","23.111.9.57","TCP","66","56469  >  443 [SYN] Seq=0 Win=64240 Len=0 MSS=1460 WS=256 SACK_PERM=1"
"107","3.150246","192.168.1.14","23.111.9.57","TCP","66","56470  >  443 [SYN] Seq=0 Win=64240 Len=0 MSS=1460 WS=256 SACK_PERM=1"
"108","3.150397","192.168.1.14","23.111.9.57","TCP","66","56471  >  443 [SYN] Seq=0 Win=64240 Len=0 MSS=1460 WS=256 SACK_PERM=1"
"109","3.150541","192.168.1.14","23.111.9.57","TCP","66","56472  >  443 [SYN] Seq=0 Win=64240 Len=0 MSS=1460 WS=256 SACK_PERM=1"
"110","3.191894","23.111.9.57","192.168.1.14","TCP","66","443  >  56469 [SYN, ACK] Seq=0 Ack=1 Win=29200 Len=0 MSS=1452 SACK_PERM=1 WS=1024"
"111","3.191999","192.168.1.14","23.111.9.57","TCP","54","56469  >  443 [ACK] Seq=1 Ack=1 Win=132096 Len=0"
"112","3.192441","192.168.1.14","23.111.9.57","TLSv1.2","571","Client Hello"
"113","3.192786","23.111.9.57","192.168.1.14","TCP","66","443  >  56470 [SYN, ACK] Seq=0 Ack=1 Win=29200 Len=0 MSS=1452 SACK_PERM=1 WS=1024"
"114","3.192843","192.168.1.14","23.111.9.57","TCP","54","56470  >  443 [ACK] Seq=1 Ack=1 Win=132096 Len=0"
"115","3.193128","192.168.1.14","23.111.9.57","TLSv1.2","571","Client Hello"
"116","3.194454","23.111.9.57","192.168.1.14","TCP","66","443  >  56471 [SYN, ACK] Seq=0 Ack=1 Win=29200 Len=0 MSS=1452 SACK_PERM=1 WS=1024"
"117","3.194525","192.168.1.14","23.111.9.57","TCP","54","56471  >  443 [ACK] Seq=1 Ack=1 Win=132096 Len=0"
"118","3.194753","192.168.1.14","23.111.9.57","TLSv1.2","571","Client Hello"
"119","3.195308","23.111.9.57","192.168.1.14","TCP","66","443  >  56472 [SYN, ACK] Seq=0 Ack=1 Win=29200 Len=0 MSS=1452 SACK_PERM=1 WS=1024"
"120","3.195346","192.168.1.14","23.111.9.57","TCP","54","56472  >  443 [ACK] Seq=1 Ack=1 Win=132096 Len=0"
"121","3.195552","192.168.1.14","23.111.9.57","TLSv1.2","571","Client Hello"
"122","3.196846","95.216.155.62","192.168.1.14","TCP","1506","443  >  56468 [ACK] Seq=47945 Ack=1966 Win=64128 Len=1452 [TCP segment of a reassembled PDU]"
"123","3.197624","95.216.155.62","192.168.1.14","TCP","1506","443  >  56468 [ACK] Seq=49397 Ack=1966 Win=64128 Len=1452 [TCP segment of a reassembled PDU]"
"124","3.197628","95.216.155.62","192.168.1.14","TCP","1506","443  >  56468 [ACK] Seq=50849 Ack=1966 Win=64128 Len=1452 [TCP segment of a reassembled PDU]"
"125","3.197629","95.216.155.62","192.168.1.14","TCP","1506","443  >  56468 [ACK] Seq=52301 Ack=1966 Win=64128 Len=1452 [TCP segment of a reassembled PDU]"
"126","3.197694","192.168.1.14","95.216.155.62","TCP","54","56468  >  443 [ACK] Seq=1966 Ack=53753 Win=132096 Len=0"
"127","3.198458","95.216.155.62","192.168.1.14","TCP","1506","443  >  56468 [ACK] Seq=53753 Ack=1966 Win=64128 Len=1452 [TCP segment of a reassembled PDU]"
"128","3.199226","95.216.155.62","192.168.1.14","TCP","1506","443  >  56468 [ACK] Seq=55205 Ack=1966 Win=64128 Len=1452 [TCP segment of a reassembled PDU]"
"129","3.199227","95.216.155.62","192.168.1.14","TCP","1506","443  >  56468 [ACK] Seq=56657 Ack=1966 Win=64128 Len=1452 [TCP segment of a reassembled PDU]"
"130","3.199230","95.216.155.62","192.168.1.14","TCP","1506","443  >  56468 [ACK] Seq=58109 Ack=1966 Win=64128 Len=1452 [TCP segment of a reassembled PDU]"
"131","3.199266","192.168.1.14","95.216.155.62","TCP","54","56468  >  443 [ACK] Seq=1966 Ack=59561 Win=132096 Len=0"
"132","3.200034","95.216.155.62","192.168.1.14","TCP","1506","443  >  56468 [ACK] Seq=59561 Ack=1966 Win=64128 Len=1452 [TCP segment of a reassembled PDU]"
"133","3.200035","95.216.155.62","192.168.1.14","TCP","1506","443  >  56468 [ACK] Seq=61013 Ack=1966 Win=64128 Len=1452 [TCP segment of a reassembled PDU]"
"134","3.200065","192.168.1.14","95.216.155.62","TCP","54","56468  >  443 [ACK] Seq=1966 Ack=62465 Win=132096 Len=0"
"135","3.200827","95.216.155.62","192.168.1.14","TCP","1506","443  >  56468 [ACK] Seq=62465 Ack=1966 Win=64128 Len=1452 [TCP segment of a reassembled PDU]"
"136","3.200828","95.216.155.62","192.168.1.14","TLSv1.2","487","Application Data"
"137","3.200860","192.168.1.14","95.216.155.62","TCP","54","56468  >  443 [ACK] Seq=1966 Ack=64350 Win=132096 Len=0"
"138","3.201622","95.216.155.62","192.168.1.14","TCP","1506","443  >  56468 [ACK] Seq=64350 Ack=1966 Win=64128 Len=1452 [TCP segment of a reassembled PDU]"
"139","3.201624","95.216.155.62","192.168.1.14","TLSv1.2","1217","Application Data"
"140","3.201663","192.168.1.14","95.216.155.62","TCP","54","56468  >  443 [ACK] Seq=1966 Ack=66965 Win=132096 Len=0"
"141","3.207945","192.168.1.14","172.217.19.110","UDP","315","57103  >  443 Len=273"
"142","3.234602","23.111.9.57","192.168.1.14","TCP","60","443  >  56469 [ACK] Seq=1 Ack=518 Win=30720 Len=0"
"143","3.235383","23.111.9.57","192.168.1.14","TCP","60","443  >  56470 [ACK] Seq=1 Ack=518 Win=30720 Len=0"
"144","3.236226","23.111.9.57","192.168.1.14","TLSv1.2","1506","Server Hello"
"145","3.237051","23.111.9.57","192.168.1.14","TCP","1506","443  >  56469 [ACK] Seq=1453 Ack=518 Win=30720 Len=1452 [TCP segment of a reassembled PDU]"
"146","3.237091","192.168.1.14","23.111.9.57","TCP","54","56469  >  443 [ACK] Seq=518 Ack=2905 Win=132096 Len=0"
"147","3.237885","23.111.9.57","192.168.1.14","TLSv1.2","1506","Certificate, Certificate Status"
"148","3.237888","23.111.9.57","192.168.1.14","TLSv1.2","245","Server Key Exchange, Server Hello Done"
"149","3.237926","192.168.1.14","23.111.9.57","TCP","54","56469  >  443 [ACK] Seq=518 Ack=4548 Win=132096 Len=0"
"150","3.238685","23.111.9.57","192.168.1.14","TLSv1.2","1506","Server Hello"
"151","3.239460","23.111.9.57","192.168.1.14","TCP","1506","443  >  56470 [ACK] Seq=1453 Ack=518 Win=30720 Len=1452 [TCP segment of a reassembled PDU]"
"152","3.239488","192.168.1.14","23.111.9.57","TCP","54","56470  >  443 [ACK] Seq=518 Ack=2905 Win=132096 Len=0"
"153","3.240249","23.111.9.57","192.168.1.14","TLSv1.2","1506","Certificate, Certificate Status"
"154","3.240251","23.111.9.57","192.168.1.14","TLSv1.2","245","Server Key Exchange, Server Hello Done"
"155","3.240278","192.168.1.14","23.111.9.57","TCP","54","56470  >  443 [ACK] Seq=518 Ack=4548 Win=132096 Len=0"
"156","3.242705","23.111.9.57","192.168.1.14","TCP","60","443  >  56471 [ACK] Seq=1 Ack=518 Win=30720 Len=0"
"157","3.243465","172.217.19.110","192.168.1.14","UDP","314","443  >  57103 Len=272"
"158","3.243466","23.111.9.57","192.168.1.14","TCP","60","443  >  56472 [ACK] Seq=1 Ack=518 Win=30720 Len=0"
"159","3.244247","23.111.9.57","192.168.1.14","TLSv1.2","1506","Server Hello"
"160","3.244249","23.111.9.57","192.168.1.14","TCP","1506","443  >  56471 [ACK] Seq=1453 Ack=518 Win=30720 Len=1452 [TCP segment of a reassembled PDU]"
"161","3.244283","192.168.1.14","23.111.9.57","TCP","54","56471  >  443 [ACK] Seq=518 Ack=2905 Win=132096 Len=0"
"162","3.245044","23.111.9.57","192.168.1.14","TLSv1.2","1506","Certificate, Certificate Status"
"163","3.245045","23.111.9.57","192.168.1.14","TLSv1.2","245","Server Key Exchange, Server Hello Done"
"164","3.245080","192.168.1.14","23.111.9.57","TCP","54","56471  >  443 [ACK] Seq=518 Ack=4548 Win=132096 Len=0"
"165","3.251805","192.168.1.14","172.217.19.110","UDP","71","57103  >  443 Len=29"
"166","3.262376","23.111.9.57","192.168.1.14","TLSv1.2","1506","Server Hello"
"167","3.263165","23.111.9.57","192.168.1.14","TCP","1506","443  >  56472 [ACK] Seq=1453 Ack=518 Win=30720 Len=1452 [TCP segment of a reassembled PDU]"
"168","3.263205","192.168.1.14","23.111.9.57","TCP","54","56472  >  443 [ACK] Seq=518 Ack=2905 Win=132096 Len=0"
"169","3.264721","23.111.9.57","192.168.1.14","TLSv1.2","1506","Certificate, Certificate Status"
"170","3.264724","23.111.9.57","192.168.1.14","TLSv1.2","245","Server Key Exchange, Server Hello Done"
"171","3.264765","192.168.1.14","23.111.9.57","TCP","54","56472  >  443 [ACK] Seq=518 Ack=4548 Win=132096 Len=0"
"172","3.271063","192.168.1.14","23.111.9.57","TLSv1.2","180","Client Key Exchange, Change Cipher Spec, Encrypted Handshake Message"
"173","3.274240","192.168.1.14","23.111.9.57","TLSv1.2","180","Client Key Exchange, Change Cipher Spec, Encrypted Handshake Message"
"174","3.278024","192.168.1.14","23.111.9.57","TLSv1.2","180","Client Key Exchange, Change Cipher Spec, Encrypted Handshake Message"
"175","3.281070","192.168.1.14","23.111.9.57","TLSv1.2","180","Client Key Exchange, Change Cipher Spec, Encrypted Handshake Message"
"176","3.282590","192.168.1.14","23.111.9.57","TCP","54","56470  >  443 [FIN, ACK] Seq=644 Ack=4548 Win=132096 Len=0"
"177","3.282861","192.168.1.14","23.111.9.57","TCP","54","56471  >  443 [FIN, ACK] Seq=644 Ack=4548 Win=132096 Len=0"
"178","3.283329","192.168.1.14","23.111.9.57","TCP","54","56472  >  443 [FIN, ACK] Seq=644 Ack=4548 Win=132096 Len=0"
"179","3.285373","192.168.1.14","172.217.19.110","UDP","1392","57103  >  443 Len=1350"
"180","3.285436","192.168.1.14","172.217.19.110","UDP","1392","57103  >  443 Len=1350"
"181","3.285470","192.168.1.14","172.217.19.110","UDP","325","57103  >  443 Len=283"
"182","3.285572","192.168.1.14","23.111.9.57","TLSv1.2","153","Application Data"
"183","3.289149","192.168.1.14","23.111.9.57","TLSv1.2","416","Application Data"
"184","3.289233","192.168.1.14","23.111.9.57","TLSv1.2","130","Application Data"
"185","3.289290","192.168.1.14","23.111.9.57","TLSv1.2","129","Application Data"
"186","3.289345","192.168.1.14","23.111.9.57","TLSv1.2","134","Application Data"
"187","3.292223","192.168.1.14","95.216.155.62","TLSv1.2","979","Application Data"
"188","3.312005","23.111.9.57","192.168.1.14","TLSv1.2","312","New Session Ticket, Change Cipher Spec, Encrypted Handshake Message"
"189","3.312781","23.111.9.57","192.168.1.14","TLSv1.2","123","Application Data"
"190","3.312803","192.168.1.14","23.111.9.57","TCP","54","56469  >  443 [ACK] Seq=1336 Ack=4875 Win=131584 Len=0"
"191","3.312906","192.168.1.14","23.111.9.57","TLSv1.2","92","Application Data"
"192","3.321006","23.111.9.57","192.168.1.14","TLSv1.2","312","New Session Ticket, Change Cipher Spec, Encrypted Handshake Message"
"193","3.321190","192.168.1.14","23.111.9.57","TCP","54","56470  >  443 [RST, ACK] Seq=645 Ack=4806 Win=0 Len=0"
"194","3.322082","23.111.9.57","192.168.1.14","TLSv1.2","123","Application Data"
"195","3.322083","172.217.19.110","192.168.1.14","UDP","63","443  >  57103 Len=21"
"196","3.330116","23.111.9.57","192.168.1.14","TLSv1.2","92","Application Data"
"197","3.330895","23.111.9.57","192.168.1.14","TCP","60","443  >  56469 [ACK] Seq=4913 Ack=1181 Win=31744 Len=0"
"198","3.331651","23.111.9.57","192.168.1.14","TLSv1.2","1370","Application Data"
"199","3.331681","192.168.1.14","23.111.9.57","TCP","54","56469  >  443 [ACK] Seq=1374 Ack=6229 Win=132096 Len=0"
"200","3.332443","23.111.9.57","192.168.1.14","TLSv1.2","961","Application Data"
"201","3.332444","23.111.9.57","192.168.1.14","TCP","60","443  >  56469 [ACK] Seq=7136 Ack=1336 Win=31744 Len=0"
"202","3.333215","23.111.9.57","192.168.1.14","TLSv1.2","1371","Application Data"
"203","3.333249","192.168.1.14","23.111.9.57","TCP","54","56469  >  443 [ACK] Seq=1374 Ack=8453 Win=132096 Len=0"
"204","3.334010","23.111.9.57","192.168.1.14","TLSv1.2","1291","Application Data"
"205","3.337228","23.111.9.57","192.168.1.14","TCP","60","443  >  56470 [FIN, ACK] Seq=4875 Ack=645 Win=30720 Len=0"
"206","3.338099","172.217.19.110","192.168.1.14","UDP","145","443  >  57103 Len=103"
"207","3.338887","172.217.19.110","192.168.1.14","UDP","107","443  >  57103 Len=65"
"208","3.344957","23.111.9.57","192.168.1.14","TLSv1.2","312","New Session Ticket, Change Cipher Spec, Encrypted Handshake Message"
"209","3.345019","192.168.1.14","23.111.9.57","TCP","54","56471  >  443 [RST, ACK] Seq=645 Ack=4806 Win=0 Len=0"
"210","3.345814","23.111.9.57","192.168.1.14","TCP","60","443  >  56471 [FIN, ACK] Seq=4806 Ack=645 Win=30720 Len=0"
"211","3.347031","192.168.1.14","172.217.19.110","UDP","71","57103  >  443 Len=29"
"212","3.364552","23.111.9.57","192.168.1.14","TCP","60","443  >  56472 [ACK] Seq=4548 Ack=645 Win=30720 Len=0"
"213","3.366992","23.111.9.57","192.168.1.14","TLSv1.2","312","New Session Ticket, Change Cipher Spec, Encrypted Handshake Message"
"214","3.367027","192.168.1.14","23.111.9.57","TCP","54","56472  >  443 [RST, ACK] Seq=645 Ack=4806 Win=0 Len=0"
"215","3.370998","23.111.9.57","192.168.1.14","TCP","60","443  >  56472 [FIN, ACK] Seq=4806 Ack=645 Win=30720 Len=0"
"216","3.374663","192.168.1.14","23.111.9.57","TCP","54","56469  >  443 [ACK] Seq=1374 Ack=9690 Win=130816 Len=0"
"217","3.395753","23.111.9.57","192.168.1.14","TCP","60","443  >  56469 [ACK] Seq=9690 Ack=1374 Win=31744 Len=0"
"218","3.399980","95.216.155.62","192.168.1.14","TCP","60","443  >  56468 [ACK] Seq=66965 Ack=2891 Win=64128 Len=0"
"219","3.464865","95.216.155.62","192.168.1.14","TLSv1.2","1421","Application Data"
"220","3.504513","192.168.1.14","95.216.155.62","TCP","54","56468  >  443 [ACK] Seq=2891 Ack=68332 Win=130560 Len=0"
"222","4.833581","192.168.1.14","172.217.18.78","UDP","65","54506  >  443 Len=23"
"223","4.885826","172.217.18.78","192.168.1.14","UDP","62","443  >  54506 Len=20"
"224","5.020489","192.168.1.14","95.216.155.62","TLSv1.2","981","Application Data"
"225","5.034835","192.168.1.14","44.226.133.70","TLSv1.2","135","Application Data"
"226","5.034909","192.168.1.14","44.226.133.70","TLSv1.2","1430","Application Data"
"227","5.086636","95.216.155.62","192.168.1.14","TCP","60","443  >  56468 [ACK] Seq=68332 Ack=3818 Win=64128 Len=0"
"228","5.177792","95.216.155.62","192.168.1.14","TLSv1.2","1421","Application Data"
"229","5.190096","192.168.1.14","172.217.19.110","UDP","1392","57103  >  443 Len=1350"
"230","5.190138","192.168.1.14","172.217.19.110","UDP","1392","57103  >  443 Len=1350"
"231","5.190178","192.168.1.14","172.217.19.110","UDP","313","57103  >  443 Len=271"
"232","5.220615","192.168.1.14","95.216.155.62","TCP","54","56468  >  443 [ACK] Seq=3818 Ack=69699 Win=132096 Len=0"
"233","5.226398","172.217.19.110","192.168.1.14","UDP","63","443  >  57103 Len=21"
"234","5.243129","172.217.19.110","192.168.1.14","UDP","136","443  >  57103 Len=94"
"235","5.243909","172.217.19.110","192.168.1.14","UDP","182","443  >  57103 Len=140"
"236","5.247699","44.226.133.70","192.168.1.14","TCP","60","443  >  51488 [ACK] Seq=550 Ack=2887 Win=148 Len=0"
"237","5.251369","192.168.1.14","172.217.19.110","UDP","71","57103  >  443 Len=29"
"238","5.252867","44.226.133.70","192.168.1.14","TLSv1.2","518","Application Data"
"239","5.253757","44.226.133.70","192.168.1.14","TLSv1.2","92","Application Data"
"240","5.253839","192.168.1.14","44.226.133.70","TCP","54","51488  >  443 [ACK] Seq=2887 Ack=1052 Win=514 Len=0"
"241","5.465173","192.168.1.14","95.216.155.62","TLSv1.2","982","Application Data"
"242","5.475513","192.168.1.14","44.226.133.70","TLSv1.2","135","Application Data"
"243","5.475580","192.168.1.14","44.226.133.70","TLSv1.2","1470","Application Data"
"244","5.531639","95.216.155.62","192.168.1.14","TCP","60","443  >  56468 [ACK] Seq=69699 Ack=4746 Win=64128 Len=0"
"245","5.625095","95.216.155.62","192.168.1.14","TLSv1.2","1422","Application Data"
"246","5.670438","192.168.1.14","95.216.155.62","TCP","54","56468  >  443 [ACK] Seq=4746 Ack=71067 Win=130560 Len=0"
"247","5.689223","44.226.133.70","192.168.1.14","TCP","60","443  >  51488 [ACK] Seq=1052 Ack=4384 Win=159 Len=0"
"248","5.692811","44.226.133.70","192.168.1.14","TLSv1.2","519","Application Data"
"249","5.693592","44.226.133.70","192.168.1.14","TLSv1.2","92","Application Data"
"250","5.693631","192.168.1.14","44.226.133.70","TCP","54","51488  >  443 [ACK] Seq=4384 Ack=1555 Win=512 Len=0"
"252","6.016364","192.168.1.14","95.216.155.62","TLSv1.2","983","Application Data"
"253","6.032312","192.168.1.14","44.226.133.70","TLSv1.2","135","Application Data"
"254","6.032673","192.168.1.14","44.226.133.70","TLSv1.2","1460","Application Data"
"255","6.082532","95.216.155.62","192.168.1.14","TCP","60","443  >  56468 [ACK] Seq=71067 Ack=5675 Win=64128 Len=0"
"256","6.155539","95.216.155.62","192.168.1.14","TLSv1.2","1422","Application Data"
"257","6.196101","192.168.1.14","95.216.155.62","TCP","54","56468  >  443 [ACK] Seq=5675 Ack=72435 Win=132096 Len=0"
"258","6.245868","44.226.133.70","192.168.1.14","TCP","60","443  >  51488 [ACK] Seq=1555 Ack=5871 Win=170 Len=0"
"259","6.249314","44.226.133.70","192.168.1.14","TLSv1.2","519","Application Data"
"260","6.250105","44.226.133.70","192.168.1.14","TLSv1.2","92","Application Data"
"261","6.250144","192.168.1.14","44.226.133.70","TCP","54","51488  >  443 [ACK] Seq=5871 Ack=2058 Win=516 Len=0"
"262","6.484862","192.168.1.14","95.216.155.62","TLSv1.2","869","Application Data"
"263","6.550437","95.216.155.62","192.168.1.14","TCP","60","443  >  56468 [ACK] Seq=72435 Ack=6490 Win=64128 Len=0"
"264","6.615036","192.168.1.14","95.216.155.62","TCP","66","56473  >  443 [SYN] Seq=0 Win=64240 Len=0 MSS=1460 WS=256 SACK_PERM=1"
"265","6.629759","192.168.1.14","44.226.133.70","TLSv1.2","135","Application Data"
"266","6.629834","192.168.1.14","44.226.133.70","TLSv1.2","1464","Application Data"
"267","6.679897","95.216.155.62","192.168.1.14","TCP","66","443  >  56473 [SYN, ACK] Seq=0 Ack=1 Win=64240 Len=0 MSS=1452 SACK_PERM=1 WS=128"
"268","6.679967","192.168.1.14","95.216.155.62","TCP","54","56473  >  443 [ACK] Seq=1 Ack=1 Win=132096 Len=0"
"269","6.680242","192.168.1.14","95.216.155.62","TLSv1.2","571","Client Hello"
"270","6.745486","95.216.155.62","192.168.1.14","TCP","60","443  >  56473 [ACK] Seq=1 Ack=518 Win=64128 Len=0"
"271","6.746319","95.216.155.62","192.168.1.14","TLSv1.2","202","Server Hello, Change Cipher Spec, Encrypted Handshake Message"
"272","6.747180","192.168.1.14","95.216.155.62","TLSv1.2","97","Change Cipher Spec, Encrypted Handshake Message"
"273","6.747406","192.168.1.14","95.216.155.62","TLSv1.2","983","Application Data"
"274","6.816154","95.216.155.62","192.168.1.14","TCP","60","443  >  56473 [ACK] Seq=149 Ack=1490 Win=64128 Len=0"
"275","6.843317","44.226.133.70","192.168.1.14","TCP","60","443  >  51488 [ACK] Seq=2058 Ack=7362 Win=181 Len=0"
"276","6.847235","44.226.133.70","192.168.1.14","TLSv1.2","520","Application Data"
"277","6.848017","44.226.133.70","192.168.1.14","TLSv1.2","92","Application Data"
"278","6.848058","192.168.1.14","44.226.133.70","TCP","54","51488  >  443 [ACK] Seq=7362 Ack=2562 Win=514 Len=0"
"279","6.901483","95.216.155.62","192.168.1.14","TLSv1.2","1422","Application Data"
"280","6.942466","192.168.1.14","95.216.155.62","TCP","54","56473  >  443 [ACK] Seq=1490 Ack=1517 Win=132096 Len=0"
"281","6.963709","192.168.1.5","224.0.0.251","MDNS","112","Standard query 0x0000 PTR _sleep-proxy._udp.local, ""QU"" question OPT"
"283","6.974629","95.216.155.62","192.168.1.14","TCP","1506","443  >  56468 [ACK] Seq=72435 Ack=6490 Win=64128 Len=1452 [TCP segment of a reassembled PDU]"
"284","6.975415","95.216.155.62","192.168.1.14","TCP","1506","443  >  56468 [ACK] Seq=73887 Ack=6490 Win=64128 Len=1452 [TCP segment of a reassembled PDU]"
"285","6.975415","95.216.155.62","192.168.1.14","TCP","1506","443  >  56468 [ACK] Seq=75339 Ack=6490 Win=64128 Len=1452 [TCP segment of a reassembled PDU]"
"286","6.975449","192.168.1.14","95.216.155.62","TCP","54","56468  >  443 [ACK] Seq=6490 Ack=76791 Win=132096 Len=0"
"287","6.976985","95.216.155.62","192.168.1.14","TCP","1506","443  >  56468 [ACK] Seq=76791 Ack=6490 Win=64128 Len=1452 [TCP segment of a reassembled PDU]"
"288","6.976986","95.216.155.62","192.168.1.14","TCP","1506","443  >  56468 [ACK] Seq=78243 Ack=6490 Win=64128 Len=1452 [TCP segment of a reassembled PDU]"
"289","6.976987","95.216.155.62","192.168.1.14","TCP","1506","443  >  56468 [ACK] Seq=79695 Ack=6490 Win=64128 Len=1452 [TCP segment of a reassembled PDU]"
"290","6.977004","192.168.1.14","95.216.155.62","TCP","54","56468  >  443 [ACK] Seq=6490 Ack=81147 Win=132096 Len=0"
"291","6.977771","95.216.155.62","192.168.1.14","TCP","1506","443  >  56468 [ACK] Seq=81147 Ack=6490 Win=64128 Len=1452 [TCP segment of a reassembled PDU]"
"292","6.977771","95.216.155.62","192.168.1.14","TCP","1506","443  >  56468 [ACK] Seq=82599 Ack=6490 Win=64128 Len=1452 [TCP segment of a reassembled PDU]"
"293","6.977772","95.216.155.62","192.168.1.14","TCP","1506","443  >  56468 [ACK] Seq=84051 Ack=6490 Win=64128 Len=1452 [TCP segment of a reassembled PDU]"
"294","6.977787","192.168.1.14","95.216.155.62","TCP","54","56468  >  443 [ACK] Seq=6490 Ack=85503 Win=132096 Len=0"
"295","6.978550","95.216.155.62","192.168.1.14","TCP","1506","443  >  56468 [ACK] Seq=85503 Ack=6490 Win=64128 Len=1452 [TCP segment of a reassembled PDU]"
"296","6.978564","192.168.1.14","95.216.155.62","TCP","54","56468  >  443 [ACK] Seq=6490 Ack=86955 Win=132096 Len=0"
"297","7.004785","192.168.1.14","172.217.19.110","UDP","65","54510  >  443 Len=23"
"298","7.041560","95.216.155.62","192.168.1.14","TCP","1506","443  >  56468 [ACK] Seq=86955 Ack=6490 Win=64128 Len=1452 [TCP segment of a reassembled PDU]"
"299","7.042349","95.216.155.62","192.168.1.14","TLSv1.2","1506","Application Data [TCP segment of a reassembled PDU]"
"300","7.042371","192.168.1.14","95.216.155.62","TCP","54","56468  >  443 [ACK] Seq=6490 Ack=89859 Win=132096 Len=0"
"301","7.043889","95.216.155.62","192.168.1.14","TCP","1506","443  >  56468 [ACK] Seq=89859 Ack=6490 Win=64128 Len=1452 [TCP segment of a reassembled PDU]"
"302","7.043890","95.216.155.62","192.168.1.14","TCP","1506","443  >  56468 [ACK] Seq=91311 Ack=6490 Win=64128 Len=1452 [TCP segment of a reassembled PDU]"
"303","7.043892","95.216.155.62","192.168.1.14","TCP","1506","443  >  56468 [ACK] Seq=92763 Ack=6490 Win=64128 Len=1452 [TCP segment of a reassembled PDU]"
"304","7.043933","192.168.1.14","95.216.155.62","TCP","54","56468  >  443 [ACK] Seq=6490 Ack=94215 Win=132096 Len=0"
"305","7.044706","95.216.155.62","192.168.1.14","TCP","1506","443  >  56468 [ACK] Seq=94215 Ack=6490 Win=64128 Len=1452 [TCP segment of a reassembled PDU]"
"306","7.044708","95.216.155.62","192.168.1.14","TCP","1506","443  >  56468 [ACK] Seq=95667 Ack=6490 Win=64128 Len=1452 [TCP segment of a reassembled PDU]"
"307","7.044709","95.216.155.62","192.168.1.14","TCP","1506","443  >  56468 [ACK] Seq=97119 Ack=6490 Win=64128 Len=1452 [TCP segment of a reassembled PDU]"
"308","7.044712","95.216.155.62","192.168.1.14","TCP","1506","443  >  56468 [ACK] Seq=98571 Ack=6490 Win=64128 Len=1452 [TCP segment of a reassembled PDU]"
"309","7.044747","192.168.1.14","95.216.155.62","TCP","54","56468  >  443 [ACK] Seq=6490 Ack=100023 Win=132096 Len=0"
"310","7.045515","95.216.155.62","192.168.1.14","TCP","1506","443  >  56468 [ACK] Seq=100023 Ack=6490 Win=64128 Len=1452 [TCP segment of a reassembled PDU]"
"311","7.045516","95.216.155.62","192.168.1.14","TCP","1506","443  >  56468 [ACK] Seq=101475 Ack=6490 Win=64128 Len=1452 [TCP segment of a reassembled PDU]"
"312","7.045518","95.216.155.62","192.168.1.14","TCP","1506","443  >  56468 [ACK] Seq=102927 Ack=6490 Win=64128 Len=1452 [TCP segment of a reassembled PDU]"
"313","7.045558","192.168.1.14","95.216.155.62","TCP","54","56468  >  443 [ACK] Seq=6490 Ack=104379 Win=132096 Len=0"
"314","7.046323","95.216.155.62","192.168.1.14","TLSv1.2","1506","Application Data [TCP segment of a reassembled PDU]"
"315","7.047103","95.216.155.62","192.168.1.14","TCP","1506","443  >  56468 [ACK] Seq=105831 Ack=6490 Win=64128 Len=1452 [TCP segment of a reassembled PDU]"
"316","7.047126","192.168.1.14","95.216.155.62","TCP","54","56468  >  443 [ACK] Seq=6490 Ack=107283 Win=132096 Len=0"
"317","7.047886","95.216.155.62","192.168.1.14","TCP","1506","443  >  56468 [ACK] Seq=107283 Ack=6490 Win=64128 Len=1452 [TCP segment of a reassembled PDU]"
"318","7.047889","95.216.155.62","192.168.1.14","TCP","1506","443  >  56468 [ACK] Seq=108735 Ack=6490 Win=64128 Len=1452 [TCP segment of a reassembled PDU]"
"319","7.047913","192.168.1.14","95.216.155.62","TCP","54","56468  >  443 [ACK] Seq=6490 Ack=110187 Win=132096 Len=0"
"320","7.048676","95.216.155.62","192.168.1.14","TCP","1506","443  >  56468 [ACK] Seq=110187 Ack=6490 Win=64128 Len=1452 [TCP segment of a reassembled PDU]"
"321","7.048677","95.216.155.62","192.168.1.14","TCP","1506","443  >  56468 [ACK] Seq=111639 Ack=6490 Win=64128 Len=1452 [TCP segment of a reassembled PDU]"
"322","7.048678","95.216.155.62","192.168.1.14","TCP","1506","443  >  56468 [ACK] Seq=113091 Ack=6490 Win=64128 Len=1452 [TCP segment of a reassembled PDU]"
"323","7.048679","95.216.155.62","192.168.1.14","TCP","1506","443  >  56468 [ACK] Seq=114543 Ack=6490 Win=64128 Len=1452 [TCP segment of a reassembled PDU]"
"324","7.048706","192.168.1.14","95.216.155.62","TCP","54","56468  >  443 [ACK] Seq=6490 Ack=115995 Win=132096 Len=0"
"325","7.057174","172.217.19.110","192.168.1.14","UDP","62","443  >  54510 Len=20"
"326","7.066399","192.168.1.14","95.216.155.62","TLSv1.2","983","Application Data"
"327","7.079488","192.168.1.14","44.226.133.70","TLSv1.2","135","Application Data"
"328","7.079558","192.168.1.14","44.226.133.70","TLSv1.2","1486","Application Data"
"329","7.108264","95.216.155.62","192.168.1.14","TCP","1506","443  >  56468 [ACK] Seq=115995 Ack=6490 Win=64128 Len=1452 [TCP segment of a reassembled PDU]"
"330","7.109088","95.216.155.62","192.168.1.14","TCP","1506","443  >  56468 [ACK] Seq=117447 Ack=6490 Win=64128 Len=1452 [TCP segment of a reassembled PDU]"
"331","7.109090","95.216.155.62","192.168.1.14","TCP","1506","443  >  56468 [ACK] Seq=118899 Ack=6490 Win=64128 Len=1452 [TCP segment of a reassembled PDU]"
"332","7.109134","192.168.1.14","95.216.155.62","TCP","54","56468  >  443 [ACK] Seq=6490 Ack=120351 Win=132096 Len=0"
"333","7.109907","95.216.155.62","192.168.1.14","TLSv1.2","1506","Application Data [TCP segment of a reassembled PDU]"
"334","7.109922","192.168.1.14","95.216.155.62","TCP","54","56468  >  443 [ACK] Seq=6490 Ack=121803 Win=132096 Len=0"
