"No.","Time","Source","Destination","Protocol","Length","Info"
"42","7.707203","109.202.106.186","192.168.1.14","TCP","1506","443  >  49923 [ACK] Seq=1 Ack=217 Win=21 Len=1452 [TCP segment of a reassembled PDU]"
"43","7.708091","109.202.106.186","192.168.1.14","TCP","1506","443  >  49923 [ACK] Seq=1453 Ack=217 Win=21 Len=1452 [TCP segment of a reassembled PDU]"
"44","7.708092","109.202.106.186","192.168.1.14","TCP","1506","443  >  49923 [ACK] Seq=2905 Ack=217 Win=21 Len=1452 [TCP segment of a reassembled PDU]"
"46","7.708961","109.202.106.186","192.168.1.14","TCP","1506","443  >  49923 [ACK] Seq=4357 Ack=217 Win=21 Len=1452 [TCP segment of a reassembled PDU]"
"48","7.709824","109.202.106.186","192.168.1.14","TCP","1506","443  >  49923 [ACK] Seq=5809 Ack=217 Win=21 Len=1452 [TCP segment of a reassembled PDU]"
"49","7.710895","109.202.106.186","192.168.1.14","TCP","1506","443  >  49923 [ACK] Seq=7261 Ack=217 Win=21 Len=1452 [TCP segment of a reassembled PDU]"
"51","7.710983","109.202.106.186","192.168.1.14","TCP","1506","443  >  49923 [ACK] Seq=8713 Ack=217 Win=21 Len=1452 [TCP segment of a reassembled PDU]"
"52","7.712052","109.202.106.186","192.168.1.14","TCP","1506","443  >  49923 [ACK] Seq=10165 Ack=217 Win=21 Len=1452 [TCP segment of a reassembled PDU]"
"54","7.713007","109.202.106.186","192.168.1.14","TCP","1506","443  >  49923 [ACK] Seq=11617 Ack=217 Win=21 Len=1452 [TCP segment of a reassembled PDU]"
"55","7.713008","109.202.106.186","192.168.1.14","TCP","1506","443  >  49923 [ACK] Seq=13069 Ack=217 Win=21 Len=1452 [TCP segment of a reassembled PDU]"
"57","7.714758","109.202.106.186","192.168.1.14","TCP","1506","443  >  49923 [ACK] Seq=14521 Ack=217 Win=21 Len=1452 [TCP segment of a reassembled PDU]"
"58","7.714759","109.202.106.186","192.168.1.14","TLSv1.2","488","Application Data"
"59","7.714759","109.202.106.186","192.168.1.14","TCP","1506","443  >  49923 [ACK] Seq=16407 Ack=217 Win=21 Len=1452 [TCP segment of a reassembled PDU]"
"60","7.714760","109.202.106.186","192.168.1.14","TCP","1506","443  >  49923 [ACK] Seq=17859 Ack=217 Win=21 Len=1452 [TCP segment of a reassembled PDU]"
"61","7.714762","109.202.106.186","192.168.1.14","TCP","1506","443  >  49923 [ACK] Seq=19311 Ack=217 Win=21 Len=1452 [TCP segment of a reassembled PDU]"
"63","7.716637","109.202.106.186","192.168.1.14","TCP","1506","443  >  49923 [ACK] Seq=20763 Ack=217 Win=21 Len=1452 [TCP segment of a reassembled PDU]"
"65","7.717506","109.202.106.186","192.168.1.14","TCP","1506","443  >  49923 [ACK] Seq=22215 Ack=217 Win=21 Len=1452 [TCP segment of a reassembled PDU]"
"66","7.718440","109.202.106.186","192.168.1.14","TCP","1506","443  >  49923 [ACK] Seq=23667 Ack=217 Win=21 Len=1452 [TCP segment of a reassembled PDU]"
"67","7.718442","109.202.106.186","192.168.1.14","TCP","1506","443  >  49923 [ACK] Seq=25119 Ack=217 Win=21 Len=1452 [TCP segment of a reassembled PDU]"
"68","7.718443","109.202.106.186","192.168.1.14","TCP","1506","443  >  49923 [ACK] Seq=26571 Ack=217 Win=21 Len=1452 [TCP segment of a reassembled PDU]"
"69","7.718443","109.202.106.186","192.168.1.14","TCP","1506","443  >  49923 [ACK] Seq=28023 Ack=217 Win=21 Len=1452 [TCP segment of a reassembled PDU]"
"70","7.718444","109.202.106.186","192.168.1.14","TCP","1506","443  >  49923 [ACK] Seq=29475 Ack=217 Win=21 Len=1452 [TCP segment of a reassembled PDU]"
"71","7.718444","109.202.106.186","192.168.1.14","TCP","1506","443  >  49923 [ACK] Seq=30927 Ack=217 Win=21 Len=1452 [TCP segment of a reassembled PDU]"
"73","7.719504","109.202.106.186","192.168.1.14","TLSv1.2","1506","Application Data, Application Data"
"74","7.719507","109.202.106.186","192.168.1.14","TCP","1506","443  >  49923 [ACK] Seq=33831 Ack=217 Win=21 Len=1452 [TCP segment of a reassembled PDU]"
"76","7.721298","109.202.106.186","192.168.1.14","TCP","1506","443  >  49923 [ACK] Seq=35283 Ack=217 Win=21 Len=1452 [TCP segment of a reassembled PDU]"
"77","7.721301","109.202.106.186","192.168.1.14","TCP","1506","443  >  49923 [ACK] Seq=36735 Ack=217 Win=21 Len=1452 [TCP segment of a reassembled PDU]"
"79","7.722222","109.202.106.186","192.168.1.14","TCP","1506","443  >  49923 [ACK] Seq=38187 Ack=217 Win=21 Len=1452 [TCP segment of a reassembled PDU]"
"80","7.722236","109.202.106.186","192.168.1.14","TCP","1506","443  >  49923 [ACK] Seq=39639 Ack=217 Win=21 Len=1452 [TCP segment of a reassembled PDU]"
"81","7.722237","109.202.106.186","192.168.1.14","TCP","1506","443  >  49923 [ACK] Seq=41091 Ack=217 Win=21 Len=1452 [TCP segment of a reassembled PDU]"
"82","7.722238","109.202.106.186","192.168.1.14","TCP","1506","443  >  49923 [ACK] Seq=42543 Ack=217 Win=21 Len=1452 [TCP segment of a reassembled PDU]"
"83","7.722238","109.202.106.186","192.168.1.14","TCP","1506","443  >  49923 [ACK] Seq=43995 Ack=217 Win=21 Len=1452 [TCP segment of a reassembled PDU]"
"84","7.722239","109.202.106.186","192.168.1.14","TCP","1506","443  >  49923 [ACK] Seq=45447 Ack=217 Win=21 Len=1452 [TCP segment of a reassembled PDU]"
"86","7.723154","109.202.106.186","192.168.1.14","TCP","1506","443  >  49923 [ACK] Seq=46899 Ack=217 Win=21 Len=1452 [TCP segment of a reassembled PDU]"
"88","7.724883","109.202.106.186","192.168.1.14","TLSv1.2","1506","Application Data [TCP segment of a reassembled PDU]"
"89","7.724884","109.202.106.186","192.168.1.14","TCP","1506","443  >  49923 [ACK] Seq=49803 Ack=217 Win=21 Len=1452 [TCP segment of a reassembled PDU]"
"90","7.724886","109.202.106.186","192.168.1.14","TCP","1506","443  >  49923 [ACK] Seq=51255 Ack=217 Win=21 Len=1452 [TCP segment of a reassembled PDU]"
"91","7.724887","109.202.106.186","192.168.1.14","TCP","1506","443  >  49923 [ACK] Seq=52707 Ack=217 Win=21 Len=1452 [TCP segment of a reassembled PDU]"
"92","7.724888","109.202.106.186","192.168.1.14","TCP","1506","443  >  49923 [ACK] Seq=54159 Ack=217 Win=21 Len=1452 [TCP segment of a reassembled PDU]"
"94","7.725804","109.202.106.186","192.168.1.14","TCP","1506","443  >  49923 [ACK] Seq=55611 Ack=217 Win=21 Len=1452 [TCP segment of a reassembled PDU]"
"95","7.725805","109.202.106.186","192.168.1.14","TCP","1506","443  >  49923 [ACK] Seq=57063 Ack=217 Win=21 Len=1452 [TCP segment of a reassembled PDU]"
"96","7.725805","109.202.106.186","192.168.1.14","TCP","1506","443  >  49923 [ACK] Seq=58515 Ack=217 Win=21 Len=1452 [TCP segment of a reassembled PDU]"
"97","7.725808","109.202.106.186","192.168.1.14","TCP","1506","443  >  49923 [ACK] Seq=59967 Ack=217 Win=21 Len=1452 [TCP segment of a reassembled PDU]"
"98","7.725809","109.202.106.186","192.168.1.14","TCP","1506","443  >  49923 [ACK] Seq=61419 Ack=217 Win=21 Len=1452 [TCP segment of a reassembled PDU]"
"99","7.725809","109.202.106.186","192.168.1.14","TCP","1506","443  >  49923 [ACK] Seq=62871 Ack=217 Win=21 Len=1452 [TCP segment of a reassembled PDU]"
"101","7.728283","109.202.106.186","192.168.1.14","TCP","1506","443  >  49923 [ACK] Seq=64323 Ack=217 Win=21 Len=1452 [TCP segment of a reassembled PDU]"
"103","7.729266","109.202.106.186","192.168.1.14","TLSv1.2","1506","Application Data, Application Data"
"104","7.729267","109.202.106.186","192.168.1.14","TCP","1506","443  >  49923 [ACK] Seq=67227 Ack=217 Win=21 Len=1452 [TCP segment of a reassembled PDU]"
"105","7.729269","109.202.106.186","192.168.1.14","TCP","1506","443  >  49923 [ACK] Seq=68679 Ack=217 Win=21 Len=1452 [TCP segment of a reassembled PDU]"
"106","7.729269","109.202.106.186","192.168.1.14","TCP","1506","443  >  49923 [ACK] Seq=70131 Ack=217 Win=21 Len=1452 [TCP segment of a reassembled PDU]"
"108","7.730144","109.202.106.186","192.168.1.14","TCP","1506","443  >  49923 [ACK] Seq=71583 Ack=217 Win=21 Len=1452 [TCP segment of a reassembled PDU]"
"109","7.731020","109.202.106.186","192.168.1.14","TCP","1506","443  >  49923 [ACK] Seq=73035 Ack=217 Win=21 Len=1452 [TCP segment of a reassembled PDU]"
"111","7.733943","109.202.106.186","192.168.1.14","TCP","1506","443  >  49923 [ACK] Seq=74487 Ack=217 Win=21 Len=1452 [TCP segment of a reassembled PDU]"
"112","7.733945","109.202.106.186","192.168.1.14","TCP","1506","443  >  49923 [ACK] Seq=75939 Ack=217 Win=21 Len=1452 [TCP segment of a reassembled PDU]"
"114","7.736755","109.202.106.186","192.168.1.14","TCP","1506","443  >  49923 [ACK] Seq=77391 Ack=217 Win=21 Len=1452 [TCP segment of a reassembled PDU]"
"115","7.736757","109.202.106.186","192.168.1.14","TCP","1506","443  >  49923 [ACK] Seq=78843 Ack=217 Win=21 Len=1452 [TCP segment of a reassembled PDU]"
"116","7.736761","109.202.106.186","192.168.1.14","TCP","1506","443  >  49923 [ACK] Seq=80295 Ack=217 Win=21 Len=1452 [TCP segment of a reassembled PDU]"
"117","7.736765","109.202.106.186","192.168.1.14","TLSv1.2","1506","Application Data [TCP segment of a reassembled PDU]"
"118","7.736768","109.202.106.186","192.168.1.14","TCP","1506","443  >  49923 [ACK] Seq=83199 Ack=217 Win=21 Len=1452 [TCP segment of a reassembled PDU]"
"119","7.736771","109.202.106.186","192.168.1.14","TCP","1506","443  >  49923 [ACK] Seq=84651 Ack=217 Win=21 Len=1452 [TCP segment of a reassembled PDU]"
"120","7.736775","109.202.106.186","192.168.1.14","TCP","1506","443  >  49923 [ACK] Seq=86103 Ack=217 Win=21 Len=1452 [TCP segment of a reassembled PDU]"
"121","7.736780","109.202.106.186","192.168.1.14","TCP","1506","443  >  49923 [ACK] Seq=87555 Ack=217 Win=21 Len=1452 [TCP segment of a reassembled PDU]"
"122","7.736785","109.202.106.186","192.168.1.14","TCP","1506","443  >  49923 [ACK] Seq=89007 Ack=217 Win=21 Len=1452 [TCP segment of a reassembled PDU]"
"123","7.736788","109.202.106.186","192.168.1.14","TCP","1506","443  >  49923 [ACK] Seq=90459 Ack=217 Win=21 Len=1452 [TCP segment of a reassembled PDU]"
"125","7.737893","109.202.106.186","192.168.1.14","TCP","1506","443  >  49923 [ACK] Seq=91911 Ack=217 Win=21 Len=1452 [TCP segment of a reassembled PDU]"
"126","7.737894","109.202.106.186","192.168.1.14","TCP","1506","443  >  49923 [ACK] Seq=93363 Ack=217 Win=21 Len=1452 [TCP segment of a reassembled PDU]"
"127","7.737895","109.202.106.186","192.168.1.14","TCP","1506","443  >  49923 [ACK] Seq=94815 Ack=217 Win=21 Len=1452 [TCP segment of a reassembled PDU]"
"128","7.737898","109.202.106.186","192.168.1.14","TCP","1506","443  >  49923 [ACK] Seq=96267 Ack=217 Win=21 Len=1452 [TCP segment of a reassembled PDU]"
"129","7.737899","109.202.106.186","192.168.1.14","TLSv1.2","1506","Application Data, Application Data"
"130","7.737900","109.202.106.186","192.168.1.14","TCP","1506","443  >  49923 [ACK] Seq=99171 Ack=217 Win=21 Len=1452 [TCP segment of a reassembled PDU]"
"132","7.739400","109.202.106.186","192.168.1.14","TCP","1506","443  >  49923 [ACK] Seq=100623 Ack=217 Win=21 Len=1452 [TCP segment of a reassembled PDU]"
"133","7.739401","109.202.106.186","192.168.1.14","TCP","1506","443  >  49923 [ACK] Seq=102075 Ack=217 Win=21 Len=1452 [TCP segment of a reassembled PDU]"
"135","7.741348","109.202.106.186","192.168.1.14","TCP","1506","443  >  49923 [ACK] Seq=103527 Ack=217 Win=21 Len=1452 [TCP segment of a reassembled PDU]"
"136","7.741352","109.202.106.186","192.168.1.14","TCP","1506","443  >  49923 [ACK] Seq=104979 Ack=217 Win=21 Len=1452 [TCP segment of a reassembled PDU]"
"138","7.741931","109.202.106.186","192.168.1.14","TCP","1506","443  >  49923 [ACK] Seq=106431 Ack=217 Win=21 Len=1452 [TCP segment of a reassembled PDU]"
"139","7.741934","109.202.106.186","192.168.1.14","TCP","1506","443  >  49923 [ACK] Seq=107883 Ack=217 Win=21 Len=1452 [TCP segment of a reassembled PDU]"
"140","7.741937","109.202.106.186","192.168.1.14","TCP","1506","443  >  49923 [ACK] Seq=109335 Ack=217 Win=21 Len=1452 [TCP segment of a reassembled PDU]"
"141","7.741941","109.202.106.186","192.168.1.14","TCP","1506","443  >  49923 [ACK] Seq=110787 Ack=217 Win=21 Len=1452 [TCP segment of a reassembled PDU]"
"142","7.741944","109.202.106.186","192.168.1.14","TCP","1506","443  >  49923 [ACK] Seq=112239 Ack=217 Win=21 Len=1452 [TCP segment of a reassembled PDU]"
"144","7.742999","109.202.106.186","192.168.1.14","TCP","1506","443  >  49923 [ACK] Seq=113691 Ack=217 Win=21 Len=1452 [TCP segment of a reassembled PDU]"
"145","7.743000","109.202.106.186","192.168.1.14","TLSv1.2","1506","Application Data [TCP segment of a reassembled PDU]"
"146","7.743001","109.202.106.186","192.168.1.14","TCP","1506","443  >  49923 [ACK] Seq=116595 Ack=217 Win=21 Len=1452 [TCP segment of a reassembled PDU]"
"147","7.743004","109.202.106.186","192.168.1.14","TCP","1506","443  >  49923 [ACK] Seq=118047 Ack=217 Win=21 Len=1452 [TCP segment of a reassembled PDU]"
"148","7.743005","109.202.106.186","192.168.1.14","TCP","1506","443  >  49923 [ACK] Seq=119499 Ack=217 Win=21 Len=1452 [TCP segment of a reassembled PDU]"
"149","7.743006","109.202.106.186","192.168.1.14","TCP","1506","443  >  49923 [ACK] Seq=120951 Ack=217 Win=21 Len=1452 [TCP segment of a reassembled PDU]"
"150","7.743007","109.202.106.186","192.168.1.14","TCP","1506","443  >  49923 [ACK] Seq=122403 Ack=217 Win=21 Len=1452 [TCP segment of a reassembled PDU]"
"151","7.743009","109.202.106.186","192.168.1.14","TCP","1506","443  >  49923 [ACK] Seq=123855 Ack=217 Win=21 Len=1452 [TCP segment of a reassembled PDU]"
"152","7.743010","109.202.106.186","192.168.1.14","TCP","1506","443  >  49923 [ACK] Seq=125307 Ack=217 Win=21 Len=1452 [TCP segment of a reassembled PDU]"
"154","7.743946","109.202.106.186","192.168.1.14","TCP","1506","443  >  49923 [ACK] Seq=126759 Ack=217 Win=21 Len=1452 [TCP segment of a reassembled PDU]"
"155","7.743947","109.202.106.186","192.168.1.14","TCP","1506","443  >  49923 [ACK] Seq=128211 Ack=217 Win=21 Len=1452 [TCP segment of a reassembled PDU]"
"156","7.743948","109.202.106.186","192.168.1.14","TCP","1506","443  >  49923 [ACK] Seq=129663 Ack=217 Win=21 Len=1452 [TCP segment of a reassembled PDU]"
"157","7.743950","109.202.106.186","192.168.1.14","TLSv1.2","1506","Application Data, Application Data"
"158","7.743951","109.202.106.186","192.168.1.14","TCP","1506","443  >  49923 [ACK] Seq=132567 Ack=217 Win=21 Len=1452 [TCP segment of a reassembled PDU]"
"159","7.743952","109.202.106.186","192.168.1.14","TCP","1506","443  >  49923 [ACK] Seq=134019 Ack=217 Win=21 Len=1452 [TCP segment of a reassembled PDU]"
"160","7.743953","109.202.106.186","192.168.1.14","TCP","1506","443  >  49923 [ACK] Seq=135471 Ack=217 Win=21 Len=1452 [TCP segment of a reassembled PDU]"
"162","7.744867","109.202.106.186","192.168.1.14","TCP","1506","443  >  49923 [ACK] Seq=136923 Ack=217 Win=21 Len=1452 [TCP segment of a reassembled PDU]"
"163","7.744868","109.202.106.186","192.168.1.14","TCP","1506","443  >  49923 [ACK] Seq=138375 Ack=217 Win=21 Len=1452 [TCP segment of a reassembled PDU]"
"164","7.744869","109.202.106.186","192.168.1.14","TCP","1506","443  >  49923 [ACK] Seq=139827 Ack=217 Win=21 Len=1452 [TCP segment of a reassembled PDU]"
"165","7.744871","109.202.106.186","192.168.1.14","TCP","1506","443  >  49923 [ACK] Seq=141279 Ack=217 Win=21 Len=1452 [TCP segment of a reassembled PDU]"
"166","7.744872","109.202.106.186","192.168.1.14","TCP","1506","443  >  49923 [ACK] Seq=142731 Ack=217 Win=21 Len=1452 [TCP segment of a reassembled PDU]"
"167","7.744872","109.202.106.186","192.168.1.14","TCP","1506","443  >  49923 [ACK] Seq=144183 Ack=217 Win=21 Len=1452 [TCP segment of a reassembled PDU]"
"169","7.748029","109.202.106.186","192.168.1.14","TCP","1506","443  >  49923 [ACK] Seq=145635 Ack=217 Win=21 Len=1452 [TCP segment of a reassembled PDU]"
"171","7.748178","109.202.106.186","192.168.1.14","TLSv1.2","1506","Application Data [TCP segment of a reassembled PDU]"
"172","7.749034","109.202.106.186","192.168.1.14","TCP","1506","443  >  49923 [ACK] Seq=148539 Ack=217 Win=21 Len=1452 [TCP segment of a reassembled PDU]"
"173","7.749037","109.202.106.186","192.168.1.14","TCP","1506","443  >  49923 [ACK] Seq=149991 Ack=217 Win=21 Len=1452 [TCP segment of a reassembled PDU]"
"174","7.749038","109.202.106.186","192.168.1.14","TCP","1506","443  >  49923 [ACK] Seq=151443 Ack=217 Win=21 Len=1452 [TCP segment of a reassembled PDU]"
"175","7.749039","109.202.106.186","192.168.1.14","TCP","1506","443  >  49923 [ACK] Seq=152895 Ack=217 Win=21 Len=1452 [TCP segment of a reassembled PDU]"
"176","7.749040","109.202.106.186","192.168.1.14","TCP","1506","443  >  49923 [ACK] Seq=154347 Ack=217 Win=21 Len=1452 [TCP segment of a reassembled PDU]"
"177","7.749041","109.202.106.186","192.168.1.14","TCP","1506","443  >  49923 [ACK] Seq=155799 Ack=217 Win=21 Len=1452 [TCP segment of a reassembled PDU]"
"179","7.749949","109.202.106.186","192.168.1.14","TCP","1506","443  >  49923 [ACK] Seq=157251 Ack=217 Win=21 Len=1452 [TCP segment of a reassembled PDU]"
"180","7.749950","109.202.106.186","192.168.1.14","TCP","1506","443  >  49923 [ACK] Seq=158703 Ack=217 Win=21 Len=1452 [TCP segment of a reassembled PDU]"
"182","7.750851","109.202.106.186","192.168.1.14","TCP","1506","443  >  49923 [PSH, ACK] Seq=160155 Ack=217 Win=21 Len=1452 [TCP segment of a reassembled PDU]"
"184","7.788789","109.202.106.186","192.168.1.14","TCP","1506","443  >  49923 [ACK] Seq=161607 Ack=217 Win=21 Len=1452 [TCP segment of a reassembled PDU]"
"185","7.789622","109.202.106.186","192.168.1.14","TCP","1506","443  >  49923 [ACK] Seq=163059 Ack=217 Win=21 Len=1452 [TCP segment of a reassembled PDU]"
"186","7.789623","109.202.106.186","192.168.1.14","TLSv1.2","171","Application Data"
"188","7.790511","109.202.106.186","192.168.1.14","TCP","1506","443  >  49923 [ACK] Seq=164628 Ack=217 Win=21 Len=1452 [TCP segment of a reassembled PDU]"
"189","7.790514","109.202.106.186","192.168.1.14","TCP","1506","443  >  49923 [ACK] Seq=166080 Ack=217 Win=21 Len=1452 [TCP segment of a reassembled PDU]"
"191","7.791409","109.202.106.186","192.168.1.14","TCP","1506","443  >  49923 [ACK] Seq=167532 Ack=217 Win=21 Len=1452 [TCP segment of a reassembled PDU]"
"192","7.791410","109.202.106.186","192.168.1.14","TCP","1506","443  >  49923 [ACK] Seq=168984 Ack=217 Win=21 Len=1452 [TCP segment of a reassembled PDU]"
"194","7.792313","109.202.106.186","192.168.1.14","TCP","1506","443  >  49923 [ACK] Seq=170436 Ack=217 Win=21 Len=1452 [TCP segment of a reassembled PDU]"
"195","7.792316","109.202.106.186","192.168.1.14","TCP","1506","443  >  49923 [ACK] Seq=171888 Ack=217 Win=21 Len=1452 [TCP segment of a reassembled PDU]"
"196","7.792317","109.202.106.186","192.168.1.14","TCP","1506","443  >  49923 [ACK] Seq=173340 Ack=217 Win=21 Len=1452 [TCP segment of a reassembled PDU]"
"198","7.793205","109.202.106.186","192.168.1.14","TCP","1506","443  >  49923 [ACK] Seq=174792 Ack=217 Win=21 Len=1452 [TCP segment of a reassembled PDU]"
"199","7.794061","109.202.106.186","192.168.1.14","TCP","1506","443  >  49923 [ACK] Seq=176244 Ack=217 Win=21 Len=1452 [TCP segment of a reassembled PDU]"
"200","7.794062","109.202.106.186","192.168.1.14","TCP","1506","443  >  49923 [ACK] Seq=177696 Ack=217 Win=21 Len=1452 [TCP segment of a reassembled PDU]"
"202","7.794972","109.202.106.186","192.168.1.14","TCP","1506","443  >  49923 [ACK] Seq=179148 Ack=217 Win=21 Len=1452 [TCP segment of a reassembled PDU]"
"203","7.794973","109.202.106.186","192.168.1.14","TLSv1.2","488","Application Data"
"204","7.794973","109.202.106.186","192.168.1.14","TCP","1506","443  >  49923 [ACK] Seq=181034 Ack=217 Win=21 Len=1452 [TCP segment of a reassembled PDU]"
"206","7.795864","109.202.106.186","192.168.1.14","TCP","1506","443  >  49923 [ACK] Seq=182486 Ack=217 Win=21 Len=1452 [TCP segment of a reassembled PDU]"
"207","7.795867","109.202.106.186","192.168.1.14","TCP","1506","443  >  49923 [ACK] Seq=183938 Ack=217 Win=21 Len=1452 [TCP segment of a reassembled PDU]"
"208","7.795868","109.202.106.186","192.168.1.14","TCP","1506","443  >  49923 [ACK] Seq=185390 Ack=217 Win=21 Len=1452 [TCP segment of a reassembled PDU]"
"209","7.795868","109.202.106.186","192.168.1.14","TCP","1506","443  >  49923 [ACK] Seq=186842 Ack=217 Win=21 Len=1452 [TCP segment of a reassembled PDU]"
"211","7.796769","109.202.106.186","192.168.1.14","TCP","1506","443  >  49923 [ACK] Seq=188294 Ack=217 Win=21 Len=1452 [TCP segment of a reassembled PDU]"
"212","7.796770","109.202.106.186","192.168.1.14","TCP","1506","443  >  49923 [ACK] Seq=189746 Ack=217 Win=21 Len=1452 [TCP segment of a reassembled PDU]"
"213","7.796771","109.202.106.186","192.168.1.14","TCP","1506","443  >  49923 [ACK] Seq=191198 Ack=217 Win=21 Len=1452 [TCP segment of a reassembled PDU]"
"214","7.796773","109.202.106.186","192.168.1.14","TCP","1506","443  >  49923 [ACK] Seq=192650 Ack=217 Win=21 Len=1452 [TCP segment of a reassembled PDU]"
"216","7.798411","109.202.106.186","192.168.1.14","TCP","1506","443  >  49923 [ACK] Seq=194102 Ack=217 Win=21 Len=1452 [TCP segment of a reassembled PDU]"
"217","7.798412","109.202.106.186","192.168.1.14","TCP","1506","443  >  49923 [ACK] Seq=195554 Ack=217 Win=21 Len=1452 [TCP segment of a reassembled PDU]"
"219","7.799287","109.202.106.186","192.168.1.14","TLSv1.2","1506","Application Data, Application Data"
"220","7.799290","109.202.106.186","192.168.1.14","TCP","1506","443  >  49923 [ACK] Seq=198458 Ack=217 Win=21 Len=1452 [TCP segment of a reassembled PDU]"
"221","7.799290","109.202.106.186","192.168.1.14","TCP","1506","443  >  49923 [ACK] Seq=199910 Ack=217 Win=21 Len=1452 [TCP segment of a reassembled PDU]"
"222","7.799291","109.202.106.186","192.168.1.14","TCP","1506","443  >  49923 [ACK] Seq=201362 Ack=217 Win=21 Len=1452 [TCP segment of a reassembled PDU]"
"224","7.800964","109.202.106.186","192.168.1.14","TCP","1506","443  >  49923 [ACK] Seq=202814 Ack=217 Win=21 Len=1452 [TCP segment of a reassembled PDU]"
"225","7.800965","109.202.106.186","192.168.1.14","TCP","1506","443  >  49923 [ACK] Seq=204266 Ack=217 Win=21 Len=1452 [TCP segment of a reassembled PDU]"
"226","7.800965","109.202.106.186","192.168.1.14","TCP","1506","443  >  49923 [ACK] Seq=205718 Ack=217 Win=21 Len=1452 [TCP segment of a reassembled PDU]"
"228","7.801866","109.202.106.186","192.168.1.14","TCP","1506","443  >  49923 [ACK] Seq=207170 Ack=217 Win=21 Len=1452 [TCP segment of a reassembled PDU]"
"229","7.801867","109.202.106.186","192.168.1.14","TCP","1506","443  >  49923 [ACK] Seq=208622 Ack=217 Win=21 Len=1452 [TCP segment of a reassembled PDU]"
"230","7.801868","109.202.106.186","192.168.1.14","TCP","1506","443  >  49923 [ACK] Seq=210074 Ack=217 Win=21 Len=1452 [TCP segment of a reassembled PDU]"
"231","7.801871","109.202.106.186","192.168.1.14","TCP","1506","443  >  49923 [ACK] Seq=211526 Ack=217 Win=21 Len=1452 [TCP segment of a reassembled PDU]"
"232","7.801871","109.202.106.186","192.168.1.14","TLSv1.2","1506","Application Data [TCP segment of a reassembled PDU]"
"234","7.803719","109.202.106.186","192.168.1.14","TCP","1506","443  >  49923 [ACK] Seq=214430 Ack=217 Win=21 Len=1452 [TCP segment of a reassembled PDU]"
"235","7.804642","109.202.106.186","192.168.1.14","TCP","1506","443  >  49923 [ACK] Seq=215882 Ack=217 Win=21 Len=1452 [TCP segment of a reassembled PDU]"
"236","7.804644","109.202.106.186","192.168.1.14","TCP","1506","443  >  49923 [ACK] Seq=217334 Ack=217 Win=21 Len=1452 [TCP segment of a reassembled PDU]"
"237","7.804647","109.202.106.186","192.168.1.14","TCP","1506","443  >  49923 [ACK] Seq=218786 Ack=217 Win=21 Len=1452 [TCP segment of a reassembled PDU]"
"239","7.805557","109.202.106.186","192.168.1.14","TCP","1506","443  >  49923 [ACK] Seq=220238 Ack=217 Win=21 Len=1452 [TCP segment of a reassembled PDU]"
"240","7.805558","109.202.106.186","192.168.1.14","TCP","1506","443  >  49923 [ACK] Seq=221690 Ack=217 Win=21 Len=1452 [TCP segment of a reassembled PDU]"
"241","7.805559","109.202.106.186","192.168.1.14","TCP","1506","443  >  49923 [ACK] Seq=223142 Ack=217 Win=21 Len=1452 [TCP segment of a reassembled PDU]"
"242","7.805562","109.202.106.186","192.168.1.14","TCP","1506","443  >  49923 [ACK] Seq=224594 Ack=217 Win=21 Len=1452 [TCP segment of a reassembled PDU]"
"243","7.805563","109.202.106.186","192.168.1.14","TCP","1506","443  >  49923 [ACK] Seq=226046 Ack=217 Win=21 Len=1452 [TCP segment of a reassembled PDU]"
"244","7.805564","109.202.106.186","192.168.1.14","TCP","1506","443  >  49923 [ACK] Seq=227498 Ack=217 Win=21 Len=1452 [TCP segment of a reassembled PDU]"
"246","7.808348","109.202.106.186","192.168.1.14","TLSv1.2","1506","Application Data [TCP segment of a reassembled PDU]"
"247","7.809200","109.202.106.186","192.168.1.14","TLSv1.2","1506","Application Data [TCP segment of a reassembled PDU]"
"248","7.809201","109.202.106.186","192.168.1.14","TCP","1506","443  >  49923 [ACK] Seq=231854 Ack=217 Win=21 Len=1452 [TCP segment of a reassembled PDU]"
"249","7.809202","109.202.106.186","192.168.1.14","TCP","1506","443  >  49923 [ACK] Seq=233306 Ack=217 Win=21 Len=1452 [TCP segment of a reassembled PDU]"
"250","7.809203","109.202.106.186","192.168.1.14","TCP","1506","443  >  49923 [ACK] Seq=234758 Ack=217 Win=21 Len=1452 [TCP segment of a reassembled PDU]"
"252","7.810083","109.202.106.186","192.168.1.14","TCP","1506","443  >  49923 [ACK] Seq=236210 Ack=217 Win=21 Len=1452 [TCP segment of a reassembled PDU]"
"253","7.810084","109.202.106.186","192.168.1.14","TCP","1506","443  >  49923 [ACK] Seq=237662 Ack=217 Win=21 Len=1452 [TCP segment of a reassembled PDU]"
"254","7.810085","109.202.106.186","192.168.1.14","TCP","1506","443  >  49923 [ACK] Seq=239114 Ack=217 Win=21 Len=1452 [TCP segment of a reassembled PDU]"
"255","7.810087","109.202.106.186","192.168.1.14","TCP","1506","443  >  49923 [ACK] Seq=240566 Ack=217 Win=21 Len=1452 [TCP segment of a reassembled PDU]"
"256","7.810088","109.202.106.186","192.168.1.14","TCP","1506","443  >  49923 [ACK] Seq=242018 Ack=217 Win=21 Len=1452 [TCP segment of a reassembled PDU]"
"258","7.811026","109.202.106.186","192.168.1.14","TCP","1506","443  >  49923 [ACK] Seq=243470 Ack=217 Win=21 Len=1452 [TCP segment of a reassembled PDU]"
"259","7.811028","109.202.106.186","192.168.1.14","TCP","1506","443  >  49923 [ACK] Seq=244922 Ack=217 Win=21 Len=1452 [TCP segment of a reassembled PDU]"
"260","7.811029","109.202.106.186","192.168.1.14","TLSv1.2","1506","Application Data [TCP segment of a reassembled PDU]"
"262","7.811930","109.202.106.186","192.168.1.14","TCP","1506","443  >  49923 [ACK] Seq=247826 Ack=217 Win=21 Len=1452 [TCP segment of a reassembled PDU]"
"264","7.812832","109.202.106.186","192.168.1.14","TCP","1506","443  >  49923 [ACK] Seq=249278 Ack=217 Win=21 Len=1452 [TCP segment of a reassembled PDU]"
"265","7.812833","109.202.106.186","192.168.1.14","TCP","1506","443  >  49923 [ACK] Seq=250730 Ack=217 Win=21 Len=1452 [TCP segment of a reassembled PDU]"
"266","7.812836","109.202.106.186","192.168.1.14","TCP","1506","443  >  49923 [ACK] Seq=252182 Ack=217 Win=21 Len=1452 [TCP segment of a reassembled PDU]"
"268","7.814289","109.202.106.186","192.168.1.14","TCP","1506","443  >  49923 [ACK] Seq=253634 Ack=217 Win=21 Len=1452 [TCP segment of a reassembled PDU]"
"269","7.814290","109.202.106.186","192.168.1.14","TCP","1506","443  >  49923 [ACK] Seq=255086 Ack=217 Win=21 Len=1452 [TCP segment of a reassembled PDU]"
"270","7.814291","109.202.106.186","192.168.1.14","TCP","1506","443  >  49923 [ACK] Seq=256538 Ack=217 Win=21 Len=1452 [TCP segment of a reassembled PDU]"
"271","7.814293","109.202.106.186","192.168.1.14","TCP","1506","443  >  49923 [ACK] Seq=257990 Ack=217 Win=21 Len=1452 [TCP segment of a reassembled PDU]"
"272","7.814294","109.202.106.186","192.168.1.14","TCP","1506","443  >  49923 [ACK] Seq=259442 Ack=217 Win=21 Len=1452 [TCP segment of a reassembled PDU]"
"274","7.815111","109.202.106.186","192.168.1.14","TCP","1506","443  >  49923 [PSH, ACK] Seq=260894 Ack=217 Win=21 Len=1452 [TCP segment of a reassembled PDU]"
"275","7.848048","109.202.106.186","192.168.1.14","TLSv1.2","924","Application Data"
"277","7.849101","109.202.106.186","192.168.1.14","TCP","1506","443  >  49923 [ACK] Seq=263216 Ack=217 Win=21 Len=1452 [TCP segment of a reassembled PDU]"
"278","7.849978","109.202.106.186","192.168.1.14","TCP","1506","443  >  49923 [ACK] Seq=264668 Ack=217 Win=21 Len=1452 [TCP segment of a reassembled PDU]"
"279","7.849979","109.202.106.186","192.168.1.14","TCP","1506","443  >  49923 [ACK] Seq=266120 Ack=217 Win=21 Len=1452 [TCP segment of a reassembled PDU]"
"280","7.849980","109.202.106.186","192.168.1.14","TCP","1506","443  >  49923 [ACK] Seq=267572 Ack=217 Win=21 Len=1452 [TCP segment of a reassembled PDU]"
"281","7.849982","109.202.106.186","192.168.1.14","TCP","1506","443  >  49923 [ACK] Seq=269024 Ack=217 Win=21 Len=1452 [TCP segment of a reassembled PDU]"
"282","7.849982","109.202.106.186","192.168.1.14","TCP","1506","443  >  49923 [ACK] Seq=270476 Ack=217 Win=21 Len=1452 [TCP segment of a reassembled PDU]"
"284","7.850849","109.202.106.186","192.168.1.14","TCP","1506","443  >  49923 [ACK] Seq=271928 Ack=217 Win=21 Len=1452 [TCP segment of a reassembled PDU]"
"285","7.850850","109.202.106.186","192.168.1.14","TCP","1506","443  >  49923 [ACK] Seq=273380 Ack=217 Win=21 Len=1452 [TCP segment of a reassembled PDU]"
"286","7.850851","109.202.106.186","192.168.1.14","TCP","1506","443  >  49923 [ACK] Seq=274832 Ack=217 Win=21 Len=1452 [TCP segment of a reassembled PDU]"
"288","7.851762","109.202.106.186","192.168.1.14","TCP","1506","443  >  49923 [ACK] Seq=276284 Ack=217 Win=21 Len=1452 [TCP segment of a reassembled PDU]"
"289","7.851763","109.202.106.186","192.168.1.14","TCP","1506","443  >  49923 [ACK] Seq=277736 Ack=217 Win=21 Len=1452 [TCP segment of a reassembled PDU]"
"290","7.851764","109.202.106.186","192.168.1.14","TLSv1.2","488","Application Data"
"291","7.851764","109.202.106.186","192.168.1.14","TCP","1506","443  >  49923 [ACK] Seq=279622 Ack=217 Win=21 Len=1452 [TCP segment of a reassembled PDU]"
"293","7.852645","109.202.106.186","192.168.1.14","TCP","1506","443  >  49923 [ACK] Seq=281074 Ack=217 Win=21 Len=1452 [TCP segment of a reassembled PDU]"
"294","7.852647","109.202.106.186","192.168.1.14","TCP","1506","443  >  49923 [ACK] Seq=282526 Ack=217 Win=21 Len=1452 [TCP segment of a reassembled PDU]"
"296","7.853582","109.202.106.186","192.168.1.14","TCP","1506","443  >  49923 [ACK] Seq=283978 Ack=217 Win=21 Len=1452 [TCP segment of a reassembled PDU]"
"297","7.853584","109.202.106.186","192.168.1.14","TCP","1506","443  >  49923 [ACK] Seq=285430 Ack=217 Win=21 Len=1452 [TCP segment of a reassembled PDU]"
"299","7.855246","109.202.106.186","192.168.1.14","TCP","1506","443  >  49923 [ACK] Seq=286882 Ack=217 Win=21 Len=1452 [TCP segment of a reassembled PDU]"
"300","7.855248","109.202.106.186","192.168.1.14","TCP","1506","443  >  49923 [ACK] Seq=288334 Ack=217 Win=21 Len=1452 [TCP segment of a reassembled PDU]"
"301","7.855248","109.202.106.186","192.168.1.14","TCP","1506","443  >  49923 [ACK] Seq=289786 Ack=217 Win=21 Len=1452 [TCP segment of a reassembled PDU]"
"302","7.855250","109.202.106.186","192.168.1.14","TCP","1506","443  >  49923 [ACK] Seq=291238 Ack=217 Win=21 Len=1452 [TCP segment of a reassembled PDU]"
"304","7.856133","109.202.106.186","192.168.1.14","TCP","1506","443  >  49923 [ACK] Seq=292690 Ack=217 Win=21 Len=1452 [TCP segment of a reassembled PDU]"
"306","7.857031","109.202.106.186","192.168.1.14","TCP","1506","443  >  49923 [ACK] Seq=294142 Ack=217 Win=21 Len=1452 [TCP segment of a reassembled PDU]"
"307","7.859282","109.202.106.186","192.168.1.14","TLSv1.2","1506","Application Data, Application Data"
"308","7.859285","109.202.106.186","192.168.1.14","TCP","1506","443  >  49923 [ACK] Seq=297046 Ack=217 Win=21 Len=1452 [TCP segment of a reassembled PDU]"
"310","7.860339","109.202.106.186","192.168.1.14","TCP","1506","443  >  49923 [ACK] Seq=298498 Ack=217 Win=21 Len=1452 [TCP segment of a reassembled PDU]"
"311","7.860340","109.202.106.186","192.168.1.14","TCP","1506","443  >  49923 [ACK] Seq=299950 Ack=217 Win=21 Len=1452 [TCP segment of a reassembled PDU]"
"312","7.860341","109.202.106.186","192.168.1.14","TCP","1506","443  >  49923 [ACK] Seq=301402 Ack=217 Win=21 Len=1452 [TCP segment of a reassembled PDU]"
"314","7.861197","109.202.106.186","192.168.1.14","TCP","1506","443  >  49923 [ACK] Seq=302854 Ack=217 Win=21 Len=1452 [TCP segment of a reassembled PDU]"
"315","7.861198","109.202.106.186","192.168.1.14","TCP","1506","443  >  49923 [ACK] Seq=304306 Ack=217 Win=21 Len=1452 [TCP segment of a reassembled PDU]"
"317","7.862098","109.202.106.186","192.168.1.14","TCP","1506","443  >  49923 [ACK] Seq=305758 Ack=217 Win=21 Len=1452 [TCP segment of a reassembled PDU]"
"318","7.862100","109.202.106.186","192.168.1.14","TCP","1506","443  >  49923 [ACK] Seq=307210 Ack=217 Win=21 Len=1452 [TCP segment of a reassembled PDU]"
"320","7.862998","109.202.106.186","192.168.1.14","TCP","1506","443  >  49923 [ACK] Seq=308662 Ack=217 Win=21 Len=1452 [TCP segment of a reassembled PDU]"
"321","7.862999","109.202.106.186","192.168.1.14","TCP","1506","443  >  49923 [ACK] Seq=310114 Ack=217 Win=21 Len=1452 [TCP segment of a reassembled PDU]"
"322","7.863000","109.202.106.186","192.168.1.14","TLSv1.2","1506","Application Data [TCP segment of a reassembled PDU]"
"323","7.863002","109.202.106.186","192.168.1.14","TCP","1506","443  >  49923 [ACK] Seq=313018 Ack=217 Win=21 Len=1452 [TCP segment of a reassembled PDU]"
"324","7.863002","109.202.106.186","192.168.1.14","TCP","1506","443  >  49923 [ACK] Seq=314470 Ack=217 Win=21 Len=1452 [TCP segment of a reassembled PDU]"
"326","7.863904","109.202.106.186","192.168.1.14","TCP","1506","443  >  49923 [ACK] Seq=315922 Ack=217 Win=21 Len=1452 [TCP segment of a reassembled PDU]"
"327","7.863905","109.202.106.186","192.168.1.14","TCP","1506","443  >  49923 [ACK] Seq=317374 Ack=217 Win=21 Len=1452 [TCP segment of a reassembled PDU]"
"328","7.863905","109.202.106.186","192.168.1.14","TCP","1506","443  >  49923 [ACK] Seq=318826 Ack=217 Win=21 Len=1452 [TCP segment of a reassembled PDU]"
"329","7.863907","109.202.106.186","192.168.1.14","TCP","1506","443  >  49923 [ACK] Seq=320278 Ack=217 Win=21 Len=1452 [TCP segment of a reassembled PDU]"
"330","7.863908","109.202.106.186","192.168.1.14","TCP","1506","443  >  49923 [ACK] Seq=321730 Ack=217 Win=21 Len=1452 [TCP segment of a reassembled PDU]"
"331","7.863909","109.202.106.186","192.168.1.14","TCP","1506","443  >  49923 [ACK] Seq=323182 Ack=217 Win=21 Len=1452 [TCP segment of a reassembled PDU]"
"333","7.864806","109.202.106.186","192.168.1.14","TCP","1506","443  >  49923 [ACK] Seq=324634 Ack=217 Win=21 Len=1452 [TCP segment of a reassembled PDU]"
"334","7.864807","109.202.106.186","192.168.1.14","TCP","1506","443  >  49923 [ACK] Seq=326086 Ack=217 Win=21 Len=1452 [TCP segment of a reassembled PDU]"
"336","7.865641","109.202.106.186","192.168.1.14","TLSv1.2","1506","Application Data [TCP segment of a reassembled PDU]"
"337","7.865644","109.202.106.186","192.168.1.14","TLSv1.2","1506","Application Data [TCP segment of a reassembled PDU]"
"338","7.865644","109.202.106.186","192.168.1.14","TCP","1506","443  >  49923 [ACK] Seq=330442 Ack=217 Win=21 Len=1452 [TCP segment of a reassembled PDU]"
"339","7.865646","109.202.106.186","192.168.1.14","TCP","1506","443  >  49923 [ACK] Seq=331894 Ack=217 Win=21 Len=1452 [TCP segment of a reassembled PDU]"
"340","7.865647","109.202.106.186","192.168.1.14","TCP","1506","443  >  49923 [ACK] Seq=333346 Ack=217 Win=21 Len=1452 [TCP segment of a reassembled PDU]"
"342","7.866487","109.202.106.186","192.168.1.14","TCP","1506","443  >  49923 [ACK] Seq=334798 Ack=217 Win=21 Len=1452 [TCP segment of a reassembled PDU]"
"343","7.866488","109.202.106.186","192.168.1.14","TCP","1506","443  >  49923 [ACK] Seq=336250 Ack=217 Win=21 Len=1452 [TCP segment of a reassembled PDU]"
"344","7.866489","109.202.106.186","192.168.1.14","TCP","1506","443  >  49923 [ACK] Seq=337702 Ack=217 Win=21 Len=1452 [TCP segment of a reassembled PDU]"
"346","7.868098","109.202.106.186","192.168.1.14","TCP","1506","443  >  49923 [ACK] Seq=339154 Ack=217 Win=21 Len=1452 [TCP segment of a reassembled PDU]"
"347","7.868099","109.202.106.186","192.168.1.14","TCP","1506","443  >  49923 [ACK] Seq=340606 Ack=217 Win=21 Len=1452 [TCP segment of a reassembled PDU]"
"349","7.868997","109.202.106.186","192.168.1.14","TCP","1506","443  >  49923 [ACK] Seq=342058 Ack=217 Win=21 Len=1452 [TCP segment of a reassembled PDU]"
"350","7.869002","109.202.106.186","192.168.1.14","TCP","1506","443  >  49923 [ACK] Seq=343510 Ack=217 Win=21 Len=1452 [TCP segment of a reassembled PDU]"
"351","7.869003","109.202.106.186","192.168.1.14","TLSv1.2","1506","Application Data [TCP segment of a reassembled PDU]"
"352","7.869004","109.202.106.186","192.168.1.14","TCP","1506","443  >  49923 [ACK] Seq=346414 Ack=217 Win=21 Len=1452 [TCP segment of a reassembled PDU]"
"354","7.869995","109.202.106.186","192.168.1.14","TCP","1506","443  >  49923 [ACK] Seq=347866 Ack=217 Win=21 Len=1452 [TCP segment of a reassembled PDU]"
"355","7.869996","109.202.106.186","192.168.1.14","TCP","1506","443  >  49923 [ACK] Seq=349318 Ack=217 Win=21 Len=1452 [TCP segment of a reassembled PDU]"
"357","7.870848","109.202.106.186","192.168.1.14","TCP","1506","443  >  49923 [ACK] Seq=350770 Ack=217 Win=21 Len=1452 [TCP segment of a reassembled PDU]"
"358","7.870849","109.202.106.186","192.168.1.14","TCP","1506","443  >  49923 [ACK] Seq=352222 Ack=217 Win=21 Len=1452 [TCP segment of a reassembled PDU]"
"359","7.870860","109.202.106.186","192.168.1.14","TCP","1506","443  >  49923 [PSH, ACK] Seq=353674 Ack=217 Win=21 Len=1452 [TCP segment of a reassembled PDU]"
"361","7.905713","109.202.106.186","192.168.1.14","TCP","1506","443  >  49923 [ACK] Seq=355126 Ack=217 Win=21 Len=1452 [TCP segment of a reassembled PDU]"
"362","7.906583","109.202.106.186","192.168.1.14","TCP","1506","443  >  49923 [ACK] Seq=356578 Ack=217 Win=21 Len=1452 [TCP segment of a reassembled PDU]"
"364","7.907544","109.202.106.186","192.168.1.14","TCP","1506","443  >  49923 [ACK] Seq=358030 Ack=217 Win=21 Len=1452 [TCP segment of a reassembled PDU]"
"365","7.907546","109.202.106.186","192.168.1.14","TCP","1506","443  >  49923 [ACK] Seq=359482 Ack=217 Win=21 Len=1452 [TCP segment of a reassembled PDU]"
"366","7.907547","109.202.106.186","192.168.1.14","TLSv1.2","924","Application Data"
"368","7.908402","109.202.106.186","192.168.1.14","TCP","1506","443  >  49923 [ACK] Seq=361804 Ack=217 Win=21 Len=1452 [TCP segment of a reassembled PDU]"
"369","7.908403","109.202.106.186","192.168.1.14","TCP","1506","443  >  49923 [ACK] Seq=363256 Ack=217 Win=21 Len=1452 [TCP segment of a reassembled PDU]"
"371","7.909240","109.202.106.186","192.168.1.14","TCP","1506","443  >  49923 [ACK] Seq=364708 Ack=217 Win=21 Len=1452 [TCP segment of a reassembled PDU]"
"373","7.910076","109.202.106.186","192.168.1.14","TCP","1506","443  >  49923 [ACK] Seq=366160 Ack=217 Win=21 Len=1452 [TCP segment of a reassembled PDU]"
"374","7.910077","109.202.106.186","192.168.1.14","TCP","1506","443  >  49923 [ACK] Seq=367612 Ack=217 Win=21 Len=1452 [TCP segment of a reassembled PDU]"
"375","7.910087","109.202.106.186","192.168.1.14","TCP","1506","443  >  49923 [ACK] Seq=369064 Ack=217 Win=21 Len=1452 [TCP segment of a reassembled PDU]"
"377","7.910936","109.202.106.186","192.168.1.14","TCP","1506","443  >  49923 [ACK] Seq=370516 Ack=217 Win=21 Len=1452 [TCP segment of a reassembled PDU]"
"378","7.910947","109.202.106.186","192.168.1.14","TCP","1506","443  >  49923 [ACK] Seq=371968 Ack=217 Win=21 Len=1452 [TCP segment of a reassembled PDU]"
"379","7.910948","109.202.106.186","192.168.1.14","TCP","1506","443  >  49923 [ACK] Seq=373420 Ack=217 Win=21 Len=1452 [TCP segment of a reassembled PDU]"
"381","7.912591","109.202.106.186","192.168.1.14","TCP","1506","443  >  49923 [ACK] Seq=374872 Ack=217 Win=21 Len=1452 [TCP segment of a reassembled PDU]"
"382","7.913428","109.202.106.186","192.168.1.14","TCP","1506","443  >  49923 [ACK] Seq=376324 Ack=217 Win=21 Len=1452 [TCP segment of a reassembled PDU]"
"383","7.913438","109.202.106.186","192.168.1.14","TLSv1.2","488","Application Data"
"385","7.914288","109.202.106.186","192.168.1.14","TCP","1506","443  >  49923 [ACK] Seq=378210 Ack=217 Win=21 Len=1452 [TCP segment of a reassembled PDU]"
